,title,author,url,num_comments,flair
181,"An estimated 46,000 people live and work on the streets of Delhi. These men, women and children all face serious illnesses because of constant exposure to dangerous levels of air pollution with 10% of the city’s deaths being linked to poor air quality.",medecipol,https://www.scitecheuropa.eu/the-air-pollution-emergency-in-delhi/96842/,2,<praw.models.reddit.submission.SubmissionFlair object at 0x7fcea9e91860>
182,Congress leader DK Shivakumar arrested in money laundering case,coolcool68,https://timesofindia.indiatimes.com/india/karnataka-congress-leader-shivakumar-arrested-by-ed/articleshow/70965054.cms,4,<praw.models.reddit.submission.SubmissionFlair object at 0x7fcea9e91b00>
183,Doctors Of India - Need advice,DesolateFonta,https://www.reddit.com/r/india/comments/cz9dgh/doctors_of_india_need_advice/,5,<praw.models.reddit.submission.SubmissionFlair object at 0x7fcea9e91da0>
184,Flipkart launches Hindi interface to tap into next 200 million e-shoppers,koonkumar,https://m.economictimes.com/industry/services/retail/flipkart-launches-hindi-interface-to-tap-into-next-200-million-e-shoppers/amp_articleshow/70964751.cms,0,<praw.models.reddit.submission.SubmissionFlair object at 0x7fcea9e9a048>
185,"Shiv Sena Activist Accuses Netflix of 'Defaming' Hindus Globally, Files Police Complaint",whtisthis,https://www.news18.com/amp/news/movies/shiv-sena-activist-files-complaint-against-netflix-for-deep-rooted-hinduphobia-content-2296261.html#referrer=https%3A%2F%2Fwww.google.com&amp_tf=From%20%251%24s,3,<praw.models.reddit.submission.SubmissionFlair object at 0x7fcea9e9a2e8>
186,Several CNG Stations Shut in Mumbai After Fire at ONGC Plant Hits Supply,deepak387,https://www.news18.com/news/india/ongc-fire-navi-mumbai-uran-plant-cng-stations-shut-after-blaze-kills-three-cisf-men-2294833.html,0,<praw.models.reddit.submission.SubmissionFlair object at 0x7fcea9e9a588>
187,"On Camera, Telangana Farmers Grovel At Officer's Feet Over Ancestral Land. Multiple cases have emerged in the last few months in which the process of computerisation and posting of land records online seems to have become a way of harassing farmers.",aiyyooooo,https://www.ndtv.com/telangana-news/on-camera-telangana-farmers-grovel-at-officers-feet-over-ancestral-land-2094113,8,<praw.models.reddit.submission.SubmissionFlair object at 0x7fcea9e9a828>
188,Confronting Line Cutters.,AfzalOzil360,https://www.reddit.com/r/india/comments/cz0eqq/confronting_line_cutters/,37,<praw.models.reddit.submission.SubmissionFlair object at 0x7fcea9e9aa90>
189,"'Sell More, Earn More': Drug Company Reps Bribe Quack Doctors to Prescribe Anti-Biotics",udi_baaba,https://thewire.in/health/sell-more-earn-more-drug-company-reps-bribe-quack-doctors-to-prescribe-anti-biotics,1,<praw.models.reddit.submission.SubmissionFlair object at 0x7fcea9e9ae80>
190,"""Not Happy, Pray He Is Out Soon"": BS Yediyurappa On DK Shivakumar Arrest",GlobalCitizen12345,https://www.ndtv.com/india-news/bs-yediyurappa-on-dk-shivakumar-arrest-not-happy-pray-he-is-out-soon-2095172,1,<praw.models.reddit.submission.SubmissionFlair object at 0x7fcea9ea3198>
191,Delhi Assembly Elections: AAP launches I Love Kejriwal campaign,banguru,https://www.indiatoday.in/amp/india/story/delhi-assembly-elections-aap-launches-i-love-kejriwal-campaign-1595083-2019-09-03?__twitter_impression=true,2,<praw.models.reddit.submission.SubmissionFlair object at 0x7fcea9ea3518>
192,What's​ up with the way we drive?,logicalcomic,https://www.reddit.com/r/india/comments/cz1vwh/whats_up_with_the_way_we_drive/,21,<praw.models.reddit.submission.SubmissionFlair object at 0x7fcea9ea37b8>
193,"""Took Me 9 Months To Get Back To Flying, Abhinandan Back In 6"": Air Chief",elleleslie008,https://www.ndtv.com/india-news/took-me-9-months-to-get-back-to-flying-abhinandan-varthaman-back-in-6-says-air-chief-marshal-bs-dhan-2094864,2,<praw.models.reddit.submission.SubmissionFlair object at 0x7fcea9ea3a20>
194,What's your right-before-sleep daily regular activity?,StormRuler,https://www.reddit.com/r/india/comments/czakpz/whats_your_rightbeforesleep_daily_regular_activity/,21,<praw.models.reddit.submission.SubmissionFlair object at 0x7fcea9ea3cc0>
195,"‘Torture chambers’ present at more Kerala govt colleges, reveals commission report | The commission, formed after the suicide attempt of a student at University College in Thiruvananthapuram, found that students' union offices were turned into torture chambers.",aiyyooooo,https://www.thenewsminute.com/article/torture-chambers-present-more-kerala-govt-colleges-reveals-commission-report-108269,19,<praw.models.reddit.submission.SubmissionFlair object at 0x7fcea9ea3f28>
196,"You Might Have a Traffic Challan Pending Online and Not Even Know it, Here’s Why",rgupta1220,https://www.news18.com/news/auto/you-might-have-a-traffic-challan-pending-online-and-not-even-know-it-heres-why-2281367.html,1,<praw.models.reddit.submission.SubmissionFlair object at 0x7fcea9eab1d0>
197,Jharkhand: Almost 3.5 Lakh Trees to Be Felled in Palamu Tiger Reserve: Wildlife conservation experts believe the move will significantly damage the reserve's ecosystem.,s18m,https://thewire.in/environment/palamu-tiger-reserve-3-44-lakh-trees-felled-north-koel-reservoir,8,<praw.models.reddit.submission.SubmissionFlair object at 0x7fcea9eab470>
198,India May Have Entered ‘Quasi-Recession’ as GDP Growth Plummets,Indianopolice,https://www.bloomberg.com/news/articles/2019-09-03/india-may-have-entered-quasi-recession-as-gdp-growth-plummets?srnd=premium-asia,18,<praw.models.reddit.submission.SubmissionFlair object at 0x7fcea9eab710>
199,Ramachandra Guha discusses the best books on Gandhi,Sarah78080,https://fivebooks.com/best-books/gandhi-ramachandra-guha/,0,<praw.models.reddit.submission.SubmissionFlair object at 0x7fcea9eaba20>
200,One Jamaat-ul-Mujahideen Bangladesh cadre held in Kolkata,BarLaws,https://www.indiatoday.in/india/story/one-jamaat-ul-mujahideen-bangladesh-cadre-held-in-kolkata-1594664-2019-09-02,1,<praw.models.reddit.submission.SubmissionFlair object at 0x7fcea9eabcf8>
201,"After Spending Teen Years in India, Adnan Sami's Son Azaan Calls Pakistan His Home",eazywalkers,https://www.news18.com/news/movies/despite-spending-teen-years-in-india-adnan-samis-son-azaan-calls-pakistan-his-home-2295871.html,10,<praw.models.reddit.submission.SubmissionFlair object at 0x7fcea9eabf98>
202,Ex-Chief Minister Ajit Jogi's Son Amit Jogi Arrested In Forgery Case,ravindra_jadeja,https://www.ndtv.com/india-news/amit-jogi-son-of-former-chhattisgarh-chief-minister-ajit-jogi-arrested-from-his-home-2094711,3,<praw.models.reddit.submission.SubmissionFlair object at 0x7fcea9f1ef60>
203,What are the top 2nd Tier cities to move to in India?,serialposter,https://www.reddit.com/r/india/comments/cz1ai7/what_are_the_top_2nd_tier_cities_to_move_to_in/,90,<praw.models.reddit.submission.SubmissionFlair object at 0x7fcea9e0e240>
204,"As Bangladesh races ahead of India, Pakistan confirms first use nuclear policy",Meraxes373,https://theprint.in/opinion/global-print/as-bangladesh-races-ahead-of-india-pakistan-reiterates-nuclear-first-use-policy/285816/,3,<praw.models.reddit.submission.SubmissionFlair object at 0x7fcea9e0e208>
205,"Karnataka Cong Leader DKS Arrested, Bandh Today",eazywalkers,http://newstimenow.com/karnataka-cong-leader-dks-arrested-bandh-today/,0,<praw.models.reddit.submission.SubmissionFlair object at 0x7fceaa834898>
206,5%...Do you know what is 5%? Chidambaram trolls Modi govt over GDP while going back to CBI custody,vectrum,https://www.indiatoday.in/india/story/watch-chidambaram-five-percent-gdp-troll-modi-govt-inx-media-case-1595038-2019-09-03,5,<praw.models.reddit.submission.SubmissionFlair object at 0x7fcea9e71f98>
207,Daytime curbs lifted in 90% of Kashmir valley,snicker33,https://www.livemint.com/news/india/daytime-curbs-lifted-in-90-of-kashmir-valley-1567452755981.html,9,<praw.models.reddit.submission.SubmissionFlair object at 0x7fcea9e71f60>
208,"Delhi: 5 held for kidnapping, killing 92-year-old ex-govt employee in Greater Kailash",Heronyy,https://www.indiatoday.in/crime/story/greater-kailash-murder-5-held-for-kidnapping-killing-1594815-2019-09-03,0,<praw.models.reddit.submission.SubmissionFlair object at 0x7fcea9e71f28>
209,Priyanka Gandhi to get full charge of Cong's UP unit.,harddisc,https://timesofindia.indiatimes.com/india/priyanka-to-get-full-charge-of-congs-up-unit/articleshow/70960759.cms,2,<praw.models.reddit.submission.SubmissionFlair object at 0x7fcea9e71eb8>
210,India’s online shoppers are all for recycling—if there’s a cashback involved,whtisthis,https://qz.com/india/1700525/indians-will-return-packaging-to-amazon-flipkart-for-cashback/,0,<praw.models.reddit.submission.SubmissionFlair object at 0x7fcea9e71e80>
211,RSS body urges PM to reconsider Bill and Melinda Gates Foundation Award,ScumOfThePlanet,https://www.deccanchronicle.com/nation/politics/030919/rss-body-urges-pm-to-reconsider-bill-and-melinda-gates-foundation-awar.html?fbclid=IwAR18ghVJEVjeFRA2Swa1ZaTklyVR7yI5WiJ9BXgDqcnSARBwDyU2mHhbRLM,5,<praw.models.reddit.submission.SubmissionFlair object at 0x7fcea9e71e48>
212,"In light of the impending probable implementation of NRC in West Bengal, I feel it is my duty to tell the story of my family (and in part, of my community) before it is lost in a sea of thousand stories.",myogname,https://www.reddit.com/r/india/comments/cz4ubj/in_light_of_the_impending_probable_implementation/,4,<praw.models.reddit.submission.SubmissionFlair object at 0x7fcea9e71e10>
213,Flavored milk,exit27b,https://www.reddit.com/r/india/comments/cz9may/flavored_milk/,13,<praw.models.reddit.submission.SubmissionFlair object at 0x7fcea9e71d68>
214,The Trade War has Come to India. Is it Ready for It?,ObjectiveReasoning,https://intpolicydigest.org/2019/09/03/the-trade-war-has-come-to-india-is-it-ready-for-it/,2,<praw.models.reddit.submission.SubmissionFlair object at 0x7fcea9e71d30>
215,Asking for some useful advice before reapplying for schengen Visa,thewolfandtiger,https://www.reddit.com/r/india/comments/czadmf/asking_for_some_useful_advice_before_reapplying/,7,<praw.models.reddit.submission.SubmissionFlair object at 0x7fcea9e71cf8>
216,More non-Muslims spying for Pakistan than Muslims: Congress leader Digvijaya Singh,computerbaba7,https://www.indiatoday.in/india/story/more-non-muslims-spying-for-pakistan-than-muslims-congress-leader-digvijaya-singh-1594060-2019-09-01,2,<praw.models.reddit.submission.SubmissionFlair object at 0x7fcea9e71cc0>
217,Artist 'walks on the moon' to highlight state of Bengaluru roads,ScumOfThePlanet,https://www.thehindu.com/news/cities/bangalore/watch-artist-walks-on-the-moon-to-highlight-state-of-bengaluru-roads/article29322161.ece,0,<praw.models.reddit.submission.SubmissionFlair object at 0x7fcea9e71be0>
218,Kashmiri shopkeeper’s killing: Hizbul Mujahideen on radar,computerbaba7,https://economictimes.indiatimes.com/news/politics-and-nation/kashmiri-shopkeepers-killing-hizbul-mujahideen-on-radar/articleshow/70953319.cms,8,<praw.models.reddit.submission.SubmissionFlair object at 0x7fcea9e71ba8>
219,What are some books/articles that co-relate Political Science with Economics in India?,rajeshk92,https://www.reddit.com/r/india/comments/cz9j6k/what_are_some_booksarticles_that_corelate/,1,<praw.models.reddit.submission.SubmissionFlair object at 0x7fcea9e71b70>
220,"""Not Happy, Pray He Is Out Soon"": BS Yediyurappa On DK Shivakumar Arrest",thewebdev,https://www.ndtv.com/india-news/bs-yediyurappa-on-dk-shivakumar-arrest-not-happy-pray-he-is-out-soon-2095172?ndtv_related,1,<praw.models.reddit.submission.SubmissionFlair object at 0x7fcea9e71b38>
221,"#WATCH: Bike borne chain snatchers caught red-handed by a woman and her daughter in Nangloi, Delhi on August 30. The chain snatchers were later arrested by police.",harddisc,https://twitter.com/ANI/status/1168851400903876608,1,<praw.models.reddit.submission.SubmissionFlair object at 0x7fcea9e784a8>
222,Northeastern States step up vigil against those excluded from NRC,madamplease,https://www.thehindu.com/news/national/northeastern-states-step-up-vigil-against-those-excluded-from-nrc/article29321836.ece,1,<praw.models.reddit.submission.SubmissionFlair object at 0x7fcea9e78400>
223,Jokes on Delhi Metro,The_quack_addict,https://www.reddit.com/r/india/comments/cz6pza/jokes_on_delhi_metro/,17,<praw.models.reddit.submission.SubmissionFlair object at 0x7fcea9e78358>
224,"Hello Top Minds of R/india, Is the Indian economy being nokia-ed?",H1ken,https://www.reddit.com/r/india/comments/cz0ctb/hello_top_minds_of_rindia_is_the_indian_economy/,42,<praw.models.reddit.submission.SubmissionFlair object at 0x7fcea9e78320>
225,Malayalis in Germany protest after Hindu groups object to serving of beef at Indian food fest,netflixo,https://www.indiatoday.in/world/story/malayalis-in-germany-protest-after-hindu-groups-object-to-serving-of-beef-at-indian-food-fest-1594656-2019-09-02,178,<praw.models.reddit.submission.SubmissionFlair object at 0x7fcea9e782e8>
226,Artist Badaal Nanjudaswamy recreates an astronaut walking on moon full or craters in Bengaluru,tilismilis,https://v.redd.it/2reqcwqrk4k31,162,<praw.models.reddit.submission.SubmissionFlair object at 0x7fcea9e78128>
227,Pakistan says no change in nuclear policy — ‘Imran Khan’s statement taken out of context’,Gavthi_Batman,https://theprint.in/world/pakistan-says-no-change-in-nuclear-policy-imran-khans-statement-taken-out-of-context/285741/amp/?__twitter_impression=true,5,<praw.models.reddit.submission.SubmissionFlair object at 0x7fcea9e780f0>
228,M(22) first solo travel to India - Help appreciated :),NxDeluxe,https://www.reddit.com/r/india/comments/cz2juj/m22_first_solo_travel_to_india_help_appreciated/,20,<praw.models.reddit.submission.SubmissionFlair object at 0x7fcea9e780b8>
229,How developed are Indian cities compared to foreign cities in their league economy wise?,Ailaoan,https://www.reddit.com/r/india/comments/cz8htt/how_developed_are_indian_cities_compared_to/,7,<praw.models.reddit.submission.SubmissionFlair object at 0x7fcea9e78080>
230,Sitharaman-led panel weighs ordinance to ban e-cigarette sales,snicker33,https://www.livemint.com/news/india/sitharaman-led-panel-weighs-ordinance-to-ban-e-cigarette-sales-1567445283545.html,16,<praw.models.reddit.submission.SubmissionFlair object at 0x7fcea9e78048>
231,On conspiracy theories about Zerodha,xmen81,https://zerodha.com/z-connect/zerodha/why-zerodha/on-conspiracy-theories-about-zerodha,1,<praw.models.reddit.submission.SubmissionFlair object at 0x7fcea9e784e0>
232,"Apurvi Chandela, Deepak Kumar hand India fourth gold medal in Rio Shooting World Cup",HornOK,https://www.aninews.in/news/sports/others/apurvi-chandela-deepak-kumar-hand-india-fourth-gold-medal-in-rio-shooting-world-cup20190902224650/,1,<praw.models.reddit.submission.SubmissionFlair object at 0x7fcea9e78780>
233,[Ask Reddit] I live in Hyderabad and my hometown is in M.P. Can i apply for passport in Hyderabad?,Rob_van_dam,https://www.reddit.com/r/india/comments/cz6fqi/ask_reddit_i_live_in_hyderabad_and_my_hometown_is/,6,<praw.models.reddit.submission.SubmissionFlair object at 0x7fcea9e78a58>
234,Please help me out.,Bigenergyyy,https://www.reddit.com/r/india/comments/cz1wmj/please_help_me_out/,9,<praw.models.reddit.submission.SubmissionFlair object at 0x7fcea9e78cf8>
235,Greenery in Delhi is underrated. (Jor Bagh) (3024x4032),reva_r,https://i.redd.it/d6yvw8n3b8k31.jpg,23,<praw.models.reddit.submission.SubmissionFlair object at 0x7fcea9e78f98>
236,Voodoo Economics,sudden_dust,https://i.redd.it/ld1t4055uck31.jpg,1,<praw.models.reddit.submission.SubmissionFlair object at 0x7fcea9e7f278>
237,Japanese restaurant in Chennai,aisxbell,https://www.reddit.com/r/india/comments/cz264o/japanese_restaurant_in_chennai/,10,<praw.models.reddit.submission.SubmissionFlair object at 0x7fcea9e7f550>
238,Sikkim rail project: Is it development or disaster waiting to happen?,Ajaatshatru34,https://india.mongabay.com/2019/09/sikkim-rail-project-is-it-development-or-disaster-waiting-to-happen/,0,<praw.models.reddit.submission.SubmissionFlair object at 0x7fcea9e7f860>
239,Registration status for Smart India Hackathon 2020,raghavkukreti,https://www.reddit.com/r/india/comments/cz36zj/registration_status_for_smart_india_hackathon_2020/,7,<praw.models.reddit.submission.SubmissionFlair object at 0x7fcea9e7fb38>
240,Merger of 10 PSU banks unlikely to revive credit flow,snicker33,https://www.livemint.com/industry/banking/merger-of-10-psu-banks-unlikely-to-revive-credit-flow-1567485706564.html,0,<praw.models.reddit.submission.SubmissionFlair object at 0x7fcea9e7fe48>
241,"Hey so I've come for a vacay to India and rn I'm the NCR for a week. Any recommendations for what I should do? Places I should visit? And pubs, clubs, restaurants? I used to live in India as a child so I've done all the sightseeing!",gucchygang,https://www.reddit.com/r/india/comments/czchur/hey_so_ive_come_for_a_vacay_to_india_and_rn_im/,0,<praw.models.reddit.submission.SubmissionFlair object at 0x7fcea9e88160>
242,This year's hand made Ganesha by my sis,nihar88,https://imgur.com/qCCbZNO,91,<praw.models.reddit.submission.SubmissionFlair object at 0x7fcea9e884e0>
243,ICICI Bank account created on my email... BUT NOT ME!,Onlyinsydney,https://www.reddit.com/r/india/comments/cz31j3/icici_bank_account_created_on_my_email_but_not_me/,8,<praw.models.reddit.submission.SubmissionFlair object at 0x7fcea9e88748>
244,Thaalam - Rhythm Of The Nation | A.R. Rahman | Virtual Bharat,munkeyy,https://www.youtube.com/watch?v=kLoHi4oeyvA&feature=youtu.be,0,<praw.models.reddit.submission.SubmissionFlair object at 0x7fcea9e889e8>
245,PM Narendra Modi sold tea at this Vadnagar stall in Gujarat. Now it will be a tourist spot,HANDSOME_RHYS,https://www.indiatoday.in/lifestyle/travel/story/pm-narendra-modi-sold-tea-at-this-vadnagar-stall-in-gujarat-now-it-will-be-a-tourist-spot-1594623-2019-09-02,33,<praw.models.reddit.submission.SubmissionFlair object at 0x7fcea9e88c88>
246,"5 killed in major fire at ONGC plant in Navi Mumbai, gas diverted to Gujarat plant",icicibank,https://www.indiatoday.in/india/story/ongc-plant-fire-navi-mumbai-update-injured-1594750-2019-09-03,6,<praw.models.reddit.submission.SubmissionFlair object at 0x7fcea9e88f98>
247,"Adivasis and the Indian State: How onset of industrialism, modernisation wreaked cultural, social and economic havoc among tribals",Ajaatshatru34,https://www.firstpost.com/india/adivasis-and-the-indian-state-how-onset-of-industrialism-modernisation-wreaked-cultural-social-and-economic-havoc-among-tribals-7270211.html,0,<praw.models.reddit.submission.SubmissionFlair object at 0x7fcea9e8e278>
248,"Mobile network boost for, inside building for private use?",gptrshbh,https://www.reddit.com/r/india/comments/cz3q70/mobile_network_boost_for_inside_building_for/,3,<praw.models.reddit.submission.SubmissionFlair object at 0x7fcea9e8e518>
249,"TIL: About Global Country of World Peace, an attempt to create micronation inaugurated by Maharishi Mahesh Yogi. It has issued a currency called the ""Raam""",HoeYouknowme,https://www.reddit.com/r/india/comments/cz4x99/til_about_global_country_of_world_peace_an/,0,<praw.models.reddit.submission.SubmissionFlair object at 0x7fcea9e8e7b8>
250,RSS Body Urges PM Narendra Modi To Reconsider Bill and Melinda Gates Foundation Award,Randomundesirable,https://www.ndtv.com/india-news/rss-body-urges-pm-narendra-modi-to-reconsider-bill-and-melinda-gates-foundation-award-2094609,1,<praw.models.reddit.submission.SubmissionFlair object at 0x7fcea9e8eda0>
251,No action against Mohammed Shami till we see chargesheet: BCCI - Times of India,harddisc,https://m.timesofindia.com/sports/cricket/news/no-action-against-mohammed-shami-till-we-see-chargesheet-bcci/amp_articleshow/70949354.cms?__twitter_impression=true,6,<praw.models.reddit.submission.SubmissionFlair object at 0x7fcea9e160b8>
252,SC notice to Chennai man for allegedly intimidating Rajeev Dhavan - Retired government official N. Shanmugham sent a letter threatening the senior advocate for representing the Muslim side in the Ayodhya title suit appeals,rajeevist,https://www.thehindu.com/news/national/sc-notice-to-chennai-man-for-allegedly-intimidating-rajeev-dhavan/article29321775.ece,0,<praw.models.reddit.submission.SubmissionFlair object at 0x7fcea9e16358>
253,"Denied access to crematorium, Madurai Dalits forced to wait with corpse in the rain",vizot,https://www.thenewsminute.com/article/denied-access-crematorium-madurai-dalits-forced-wait-corpse-rain-108246,53,<praw.models.reddit.submission.SubmissionFlair object at 0x7fcea9e16630>
254,Places to drink with friends in Raipur?,scarlettohara403,https://www.reddit.com/r/india/comments/cz808o/places_to_drink_with_friends_in_raipur/,3,<praw.models.reddit.submission.SubmissionFlair object at 0x7fcea9e168d0>
255,Former Pak envoy to India thinks porn star Johnny Sins is a 'Kashmiri blinded by pellets',2EyedRaven,https://www.dnaindia.com/india/photo-gallery-former-pak-envoy-to-india-confuses-porn-star-johnny-sins-with-a-kashmiri-blinded-by-pellets-2786945,15,<praw.models.reddit.submission.SubmissionFlair object at 0x7fcea9e16c50>
256,What are the key reasons behind India’s rising electronic exports?,snicker33,https://www.livemint.com/market/mark-to-market/what-are-the-key-reasons-behind-india-s-rising-electronic-exports-1567447780118.html,10,<praw.models.reddit.submission.SubmissionFlair object at 0x7fcea9e16f60>
257,Aadhaar is back for mutual fund investments,UngilUndy,https://economictimes.indiatimes.com/mf/analysis/aadhaar-is-back-for-mutual-fund-investments/articleshow/70954556.cms,0,<praw.models.reddit.submission.SubmissionFlair object at 0x7fcea9e1f240>
258,Can India reduce deaths on one hazardous road to zero? This group is trying.,snowblue83,https://english.cw.com.tw/article/article.action?id=2535&utm_source=forum_reddit&utm_medium=social&utm_campaign=forum_reddit,1,<praw.models.reddit.submission.SubmissionFlair object at 0x7fcea9e1f518>
259,Don't decide Ayodhya case on Hindus' belief: Muslim parties to SC.,harddisc,https://m.timesofindia.com/india/ex-union-minister-krishna-tirath-rejoins-congress/articleshow/70952828.cms,42,<praw.models.reddit.submission.SubmissionFlair object at 0x7fcea9e1f7b8>
260,[NP] A stupid culture I have noticed in college...is this dangerous?,SkullFuckRainbow,https://www.reddit.com/r/india/comments/cz7ftk/np_a_stupid_culture_i_have_noticed_in_collegeis/,10,<praw.models.reddit.submission.SubmissionFlair object at 0x7fcea9e1fa90>
261,Which city is better for long term settlement in India?,Ace_z,https://www.reddit.com/r/india/comments/cz14xh/which_city_is_better_for_long_term_settlement_in/,29,<praw.models.reddit.submission.SubmissionFlair object at 0x7fcea9e1fe48>
262,"Comments invited on Healthcare Service Personnel and Clinical Establishments (Prohibition of violence and damage to property) Act, Bill : Submit before 2nd October",policychettan,https://www.reddit.com/r/india/comments/cz0nje/comments_invited_on_healthcare_service_personnel/,0,<praw.models.reddit.submission.SubmissionFlair object at 0x7fcea9e27128>
263,"Woman Raped In Haryana Commits Suicide, Allegedly Over Police Inaction",Greatfool19000,https://www.ndtv.com/cities/22-year-old-woman-raped-in-haryana-commits-suicide-over-police-inaction-2094980?amp=1&akamai-rum=off&__twitter_impression=true,0,<praw.models.reddit.submission.SubmissionFlair object at 0x7fcea9e273c8>
264,"Gurugram Police Fines Delhi Man Rs 23,000 as New Motor Vehicles Act kicks in",shr612,https://www.news18.com/news/auto/gurugram-police-fines-delhi-man-for-rs-23000-as-new-motor-vehicles-act-kicks-in-2295621.html,0,<praw.models.reddit.submission.SubmissionFlair object at 0x7fcea9e276a0>
265,How’s cellone/Bsnl postpaid?,ingenioutor,https://www.reddit.com/r/india/comments/cz26rw/hows_cellonebsnl_postpaid/,3,<praw.models.reddit.submission.SubmissionFlair object at 0x7fcea9e279b0>
266,India’s mobile payments firm MobiKwik reaches rare key profit milestone,papersupplies,https://techcrunch.com/2019/09/03/mobikwik-ebidta-positive/,0,<praw.models.reddit.submission.SubmissionFlair object at 0x7fcea9e27c50>
267,I'm a Malayalee ABCD. Ask Me Anything.,simsim1000,https://www.reddit.com/r/india/comments/cz98so/im_a_malayalee_abcd_ask_me_anything/,39,<praw.models.reddit.submission.SubmissionFlair object at 0x7fcea9e27fd0>
268,Bernie (Sanders) Speaks Up On Kashmir Crisis,DoubleTFan,https://www.youtube.com/watch?v=S5NtQ8OpRuY,56,<praw.models.reddit.submission.SubmissionFlair object at 0x7fcea9e2d2b0>
269,Need advice for a fashion boutique store,needAdviceGiveAdvice,https://www.reddit.com/r/india/comments/cz08hf/need_advice_for_a_fashion_boutique_store/,7,<praw.models.reddit.submission.SubmissionFlair object at 0x7fcea9e2d550>
270,Electrical outlets in India,Varekai79,https://www.reddit.com/r/india/comments/cz4aps/electrical_outlets_in_india/,8,<praw.models.reddit.submission.SubmissionFlair object at 0x7fcea9e2d7f0>
271,"Are there any famous activist investors like Carl Icahn in India? If yes, who?",junk_mail_haver,https://www.reddit.com/r/india/comments/cz8rek/are_there_any_famous_activist_investors_like_carl/,0,<praw.models.reddit.submission.SubmissionFlair object at 0x7fcea9e2da90>
272,Torn between whether to choose Canada or Australia for further studies,4evahungry,https://www.reddit.com/r/india/comments/cz4498/torn_between_whether_to_choose_canada_or/,5,<praw.models.reddit.submission.SubmissionFlair object at 0x7fcea9e2dd30>
273,"No, Kerala college did not raise Pak flag; media publishes misleading reports",vizot,https://www.altnews.in/no-kerala-college-did-not-raise-pak-flag-media-publishes-misleading-reports/,30,<praw.models.reddit.submission.SubmissionFlair object at 0x7fcea9e37160>
