,title,author,url,num_comments,flair
372,Soli Trip to Himachal Pradesh during Christmas.,wingardium_samosa,https://www.reddit.com/r/india/comments/cysxkp/soli_trip_to_himachal_pradesh_during_christmas/,1,<praw.models.reddit.submission.SubmissionFlair object at 0x7fcea9d6a438>
373,Nation’s orphans,mr-kashyap,https://indianexpress.com/article/opinion/editorials/nrc-final-list-released-assam-illegal-migrants-5957218/,0,<praw.models.reddit.submission.SubmissionFlair object at 0x7fcea9d6a6d8>
374,SBI Card to launch RuPay credit cards,HornOK,https://www.livemint.com/money/personal-finance/sbi-card-to-soon-issue-rupay-credit-cards-ceo-hardayal-prasad-1567339811275.html,6,<praw.models.reddit.submission.SubmissionFlair object at 0x7fcea9d6a978>
375,"Shooting World Cup: Yashaswini Deswal wins 10m Air Pistol gold, secures Olympic quota",HornOK,https://timesofindia.com/sports/more-sports/shooting/shooting-world-cup-yashaswini-deswal-wins-10m-air-pistol-gold-secures-olympic-quota/articleshow/70929709.cms,0,<praw.models.reddit.submission.SubmissionFlair object at 0x7fcea9d6ac50>
376,Number of active terrorists decrease from thousands to just 150-200,CherryBlackEyes,https://www.ndtv.com/india-news/number-of-active-terrorists-in-jammu-and-kashmir-has-declined-official-2093986?amp=1&akamai-rum=off,5,<praw.models.reddit.submission.SubmissionFlair object at 0x7fcea9d6afd0>
377,Hampta pass (Manali) trek in November?,naval_brat,https://www.reddit.com/r/india/comments/cytmv9/hampta_pass_manali_trek_in_november/,2,<praw.models.reddit.submission.SubmissionFlair object at 0x7fcea9d72278>
378,"Digvijaya Singh trying to destabilise Kamal Nath government, Madhya Pradesh minister writes to Sonia.",harddisc,https://m.timesofindia.com/india/digvijaya-singh-trying-to-destabilise-kamal-nath-government-madhya-pradesh-minister-writes-to-sonia/articleshow/70947616.cms,0,<praw.models.reddit.submission.SubmissionFlair object at 0x7fcea9d72588>
379,what courses should I study to learn how manage a business,irnewbie,https://www.reddit.com/r/india/comments/cylc2j/what_courses_should_i_study_to_learn_how_manage_a/,8,<praw.models.reddit.submission.SubmissionFlair object at 0x7fcea9d727f0>
380,What do you guys think about this?,Acetylated_Morphine,https://i.redd.it/whiqfzwnryj31.png,255,<praw.models.reddit.submission.SubmissionFlair object at 0x7fcea9d72a58>
381,How unethical/illegal is my doctor mom's behavior?,concernedbrothrowawa,https://www.reddit.com/r/india/comments/cy9zyu/how_unethicalillegal_is_my_doctor_moms_behavior/,172,<praw.models.reddit.submission.SubmissionFlair object at 0x7fcea9d72d30>
382,rules for driving out of state bike in Bangalore,random_dude_101,https://www.reddit.com/r/india/comments/cypidn/rules_for_driving_out_of_state_bike_in_bangalore/,4,<praw.models.reddit.submission.SubmissionFlair object at 0x7fcea9d72fd0>
383,The first river-linking project,harddisc,https://www.dnaindia.com/analysis/column-the-first-river-linking-project-2785967,0,<praw.models.reddit.submission.SubmissionFlair object at 0x7fcea9d782b0>
384,Auto industry seeks immediate policy steps as sales continue to plummet,UngilUndy,https://www.moneycontrol.com/news/business/economy/auto-industry-seeks-immediate-policy-steps-as-sales-continue-to-plummet-4395901.html,1,<praw.models.reddit.submission.SubmissionFlair object at 0x7fcea9d786a0>
385,Mi Band and shitty replacement straps,fretboard_squatter,https://www.reddit.com/r/india/comments/cynf0b/mi_band_and_shitty_replacement_straps/,11,<praw.models.reddit.submission.SubmissionFlair object at 0x7fcea9d78940>
386,Closer To Moon. Lander 'Vikram' Separates From Chandrayaan 2 Orbiter,IndiaNgineer,https://www.ndtv.com/india-news/moon-lander-vikram-separates-from-chandrayaan-2-orbiter-will-touch-down-on-lunar-surface-on-septembe-2094263?pfrom=home-topscroll,0,<praw.models.reddit.submission.SubmissionFlair object at 0x7fcea9d78c18>
387,Help for Non-CS engineers.,yougotherpes,https://www.reddit.com/r/india/comments/cyn7cd/help_for_noncs_engineers/,4,<praw.models.reddit.submission.SubmissionFlair object at 0x7fcea9d78eb8>
388,"""All But Sharad Pawar, Prithviraj Chavan Will Join BJP If..."": Amit Shah",GlobalCitizen12345,https://www.ndtv.com/india-news/amit-shah-says-all-but-sharad-pawar-prithviraj-chavan-will-join-bjp-if-it-opens-door-completely-2094028,2,<praw.models.reddit.submission.SubmissionFlair object at 0x7fcea9d81198>
389,'Every world leader has discussed yoga',sudden_dust,https://i.redd.it/1g76duiycwj31.jpg,116,<praw.models.reddit.submission.SubmissionFlair object at 0x7fcea9d81438>
390,Every Third Indian Cop Thinks Mob Violence Over Cow Slaughter Is ‘Natural’: New Survey,Ajaatshatru34,https://www.indiaspend.com/every-third-indian-cop-thinks-mob-violence-over-cow-slaughter-is-natural-new-survey/,37,<praw.models.reddit.submission.SubmissionFlair object at 0x7fcea9d816d8>
391,What Really Caused the Violence of Partition?,Tengri_99,https://thediplomat.com/2019/08/what-really-caused-the-violence-of-partition/,3,<praw.models.reddit.submission.SubmissionFlair object at 0x7fcea9d81978>
392,"With meticulous planning, mass arrests and ‘torture’, Kashmir's autonomy was lost",slasherman,https://www.independent.co.uk/news/world/asia/kashmir-crisis-latest-india-article-370-autonomy-torture-claims-planning-a9086611.html?amp&utm_source=reddit.com,0,<praw.models.reddit.submission.SubmissionFlair object at 0x7fcea9d81c18>
393,"Random Daily Discussion Thread - September 02, 2019 at 09:15AM",oxythebot,https://www.reddit.com/r/india/comments/cyjvdq/random_daily_discussion_thread_september_02_2019/,261,<praw.models.reddit.submission.SubmissionFlair object at 0x7fcea9d81eb8>
394,Need some career advice,IamEvilMorty,https://www.reddit.com/r/india/comments/cyox55/need_some_career_advice/,3,<praw.models.reddit.submission.SubmissionFlair object at 0x7fcea9d8b278>
395,What's a good product in India for removing stains from clothes?,Curious-Cat-2020,https://www.reddit.com/r/india/comments/cyjt8m/whats_a_good_product_in_india_for_removing_stains/,16,<praw.models.reddit.submission.SubmissionFlair object at 0x7fcea9d8b630>
396,"Highest ever 49,29,121 e-returns filed in a single day on August 31: CBDT",notmefr,https://www.aninews.in/news/national/general-news/highest-ever-4929121-e-returns-filed-in-a-single-day-on-august-31-cbdt20190901180850/?utm_campaign=fullarticle&utm_medium=referral&utm_source=inshorts,0,<praw.models.reddit.submission.SubmissionFlair object at 0x7fcea9d8b9b0>
397,Help me with my project about Holi Festival,dogseeker,https://www.reddit.com/r/india/comments/cyq6aw/help_me_with_my_project_about_holi_festival/,3,<praw.models.reddit.submission.SubmissionFlair object at 0x7fcea9d8bc50>
398,Question on the recent changes happening to IIT admission,humanAK47,https://www.reddit.com/r/india/comments/cyq21y/question_on_the_recent_changes_happening_to_iit/,1,<praw.models.reddit.submission.SubmissionFlair object at 0x7fcea9d8bef0>
399,"ET NOW on Twitter: #AutoSales | Maruti Suzuki's passenger car sales down 42.2% at 65,993 units Vs 1.14 lakh units (YoY). Alert: This is a worst ever drop in the sales by Maruti. @Maruti_Corp",udi_baaba,https://twitter.com/ETNOWlive/status/1168100086242365441,46,<praw.models.reddit.submission.SubmissionFlair object at 0x7fcea9d131d0>
400,At each-other's throats,HANDSOME_RHYS,https://www.reddit.com/r/india/comments/cyleal/at_eachothers_throats/,2,<praw.models.reddit.submission.SubmissionFlair object at 0x7fcea9d13470>
401,Ganesh Chaturthi Special: A Visual Story of the Elephant God - In Pics,eazywalkers,https://www.news18.com/photogallery/india/ganesh-chaturthi-special-a-visual-story-of-the-elephant-god-1501171-1.html,0,<praw.models.reddit.submission.SubmissionFlair object at 0x7fcea9d13780>
402,Must watch movies and TV shows in the last 10 years?,vegmarv,https://www.reddit.com/r/india/comments/cymm27/must_watch_movies_and_tv_shows_in_the_last_10/,18,<praw.models.reddit.submission.SubmissionFlair object at 0x7fcea9de0d68>
403,"Still On Drawing Board, ISRO's Newest Rocket ""Baby PSLV"" Scores A Deal",kaafikurious,https://www.ndtv.com/india-news/still-on-drawing-board-isros-newest-rocket-baby-pslv-scores-a-deal-2094076?pfrom=home-topscroll,0,<praw.models.reddit.submission.SubmissionFlair object at 0x7fcea9eb5908>
404,Chandrayaan2 Latest updates - ISRO,feuhrer,https://www.isro.gov.in/chandrayaan2-latest-updates,2,<praw.models.reddit.submission.SubmissionFlair object at 0x7fcea9d50c88>
405,How to get EWS quota ceritificate?,sbiswas16,https://www.reddit.com/r/india/comments/cyrujb/how_to_get_ews_quota_ceritificate/,0,<praw.models.reddit.submission.SubmissionFlair object at 0x7fcea9d50b70>
406,"Nirmala Sitharaman refuses to answer questions on economic slowdown, Manmohan remark",Indianopolice,https://www.indiatoday.in/india/story/nirmala-sitharaman-comment-on-economic-slowdown-manmohan-singh-1594144-2019-09-01,64,<praw.models.reddit.submission.SubmissionFlair object at 0x7fcea9d50a90>
407,Ex-PM Manmohan Singh: The state of economy today is deeply worrying. Last quarter's GDP growth rate of 5% signals that were in midst of a prolonged slowdown. India has potential to grow at a much faster rate but all round mismanagement by Modi govt has resulted in this slowdown.,Gavthi_Batman,https://twitter.com/ANI/status/1168025028916465665?s=19,118,<praw.models.reddit.submission.SubmissionFlair object at 0x7fcea9d50a58>
408,"Hilfort Palace, Hyderabad - Community cleanup drive",shyderabadi,https://www.reddit.com/r/india/comments/cyd78s/hilfort_palace_hyderabad_community_cleanup_drive/,9,<praw.models.reddit.submission.SubmissionFlair object at 0x7fcea9d50a20>
409,"V-Mart to hire 2,000 people; invest Rs 115 cr for 60 new stores, back-end support in FY20",HornOK,https://economictimes.com/industry/services/retail/v-mart-to-hire-2000-people-invest-rs-115-cr-for-60-new-stores-back-end-support-in-fy20/articleshow/70932713.cms,0,<praw.models.reddit.submission.SubmissionFlair object at 0x7fcea9d509e8>
410,NRAI hits out at Zomato for intentions to introduce its gold programme to delivery vertical,nobody_u_kno,https://www.livemint.com/companies/news/nrai-hits-out-at-zomato-for-intentions-to-introduce-its-gold-programme-to-delivery-vertical-1567168836855.html,0,<praw.models.reddit.submission.SubmissionFlair object at 0x7fcea9d509b0>
411,"BMC approves felling of around 3,000 trees in Mumbai Aarey Forest.",mahajn_kartik32,https://www.reddit.com/r/india/comments/cybt0f/bmc_approves_felling_of_around_3000_trees_in/,12,<praw.models.reddit.submission.SubmissionFlair object at 0x7fcea9d50978>
412,Security forces help disabled J&K player reach Chennai in just 48 hours for trials - The Hindu,dev_tomato,https://www.thehindu.com/news/national/security-forces-help-disabled-jk-player-reach-chennai-in-just-48-hours-for-trials/article29316140.ece,1,<praw.models.reddit.submission.SubmissionFlair object at 0x7fcea9d50940>
413,"Vikram-Pragyan break away from Chandrayaan-2 orbiter, All eyes now on moon landing.",harddisc,https://m.timesofindia.com/india/vikram-pragyan-break-away-from-chandrayaan-2-orbiter-all-eyes-now-on-moon-landing/articleshow/70944056.cms,0,<praw.models.reddit.submission.SubmissionFlair object at 0x7fcea9d508d0>
414,"Chandrayaan 2 completes final lunar orbit manoeuvre, stage set for lander separation",meekaa_saangoo,https://www.thehindu.com/sci-tech/science/chandrayaan-2-completes-final-lunar-orbit-manoeuvre/article29315948.ece,3,<praw.models.reddit.submission.SubmissionFlair object at 0x7fcea9d50898>
415,2018 Corporate Accountability Index - Ranking Digital Rights,myspagat,https://rankingdigitalrights.org/index2018/indicators/f10/,0,<praw.models.reddit.submission.SubmissionFlair object at 0x7fcea9d50860>
416,What is the cost of India's deadly air pollution? | Counting the Cost,andrewvanzyl,https://www.reddit.com/r/india/comments/cynuy8/what_is_the_cost_of_indias_deadly_air_pollution/,0,<praw.models.reddit.submission.SubmissionFlair object at 0x7fcea9d50828>
417,"Kerala's new governor had walked out of Rajiv Gandhi's cabinet over Shah Bano case, batted for triple talaq abolition | Arif Mohammad Khan had in 1986 walked out, when the govt gave into pressure from the clergy & reversed Supreme Court's Shah Bano verdict granting alimony to a divorced Muslim woman",aiyyooooo,https://www.news18.com/news/india/keralas-new-governor-arif-mohammad-khanhad-walked-out-of-rajiv-cabinet-over-shah-bano-case-batted-for-triple-talaq-abolition-2292711.html,17,<praw.models.reddit.submission.SubmissionFlair object at 0x7fcea9d507b8>
418,BJP shows how EVMs can be tampered with,51837,https://mumbaimirror.indiatimes.com/mumbai/other/bjp-shows-how-evms-can-be-tampered-with/articleshow/15941230.cms,14,<praw.models.reddit.submission.SubmissionFlair object at 0x7fcea9d50780>
419,Can you recommend a laptop for a computer science student?,Pritesh190801,https://www.reddit.com/r/india/comments/cyt5o6/can_you_recommend_a_laptop_for_a_computer_science/,7,<praw.models.reddit.submission.SubmissionFlair object at 0x7fcea9d50748>
420,BJP government has proved you don’t need “scams” to tank the economy.,netflixo,https://www.reddit.com/r/india/comments/cy6ati/bjp_government_has_proved_you_dont_need_scams_to/,102,<praw.models.reddit.submission.SubmissionFlair object at 0x7fcea9d506a0>
421,Opinion | A big bank theory that won’t suffice,me_tera_tau,https://www.livemint.com/opinion/online-views/opinion-a-big-bank-theory-that-won-t-suffice-1567359628301.html,0,<praw.models.reddit.submission.SubmissionFlair object at 0x7fcea9d50668>
422,What are some treks to take in the September,throwmeawaylater10,https://www.reddit.com/r/india/comments/cyj19u/what_are_some_treks_to_take_in_the_september/,2,<praw.models.reddit.submission.SubmissionFlair object at 0x7fcea9d50630>
423,"Indian Officer Meets Kulbhushan Jadhav, Sentenced To Death By Pak Court",faisalkhan096,https://www.ndtv.com/india-news/india-to-get-consular-access-to-kulbhushan-jadhav-today-hope-pakistan-will-ensure-right-atmosphere-s-2094152,0,<praw.models.reddit.submission.SubmissionFlair object at 0x7fcea9d505f8>
424,"[NP] Devs of /r/India, how do I get into machine learning?",WeekSpeller,https://www.reddit.com/r/india/comments/cymdkq/np_devs_of_rindia_how_do_i_get_into_machine/,10,<praw.models.reddit.submission.SubmissionFlair object at 0x7fcea9d50518>
425,[NP] Tilting the scales: Obesity is growing among women and girls in urban India,ponniyin_selvan,https://scroll.in/article/935312/tilting-the-scales-obesity-is-growing-among-women-and-girls-in-urban-india,16,<praw.models.reddit.submission.SubmissionFlair object at 0x7fcea9d504e0>
426,Please help me find the perfume/similar fragrance.,YurikaIto,https://www.reddit.com/r/india/comments/cykndf/please_help_me_find_the_perfumesimilar_fragrance/,0,<praw.models.reddit.submission.SubmissionFlair object at 0x7fcea9d504a8>
427,What to buy as memorabilia from Chennai and where.,bennyman32,https://www.reddit.com/r/india/comments/cyj3q6/what_to_buy_as_memorabilia_from_chennai_and_where/,8,<praw.models.reddit.submission.SubmissionFlair object at 0x7fcea9d50470>
428,Late Night Random Discussion Thread !,oxythebot,https://www.reddit.com/r/india/comments/cybii0/late_night_random_discussion_thread/,1890,<praw.models.reddit.submission.SubmissionFlair object at 0x7fcea9d50e80>
429,Manmohan Singh blames ‘all round mismanagement’ by Modi govt for economic slowdown,notautobot,https://indianexpress.com/article/business/economy/manmohan-singh-blames-all-round-mismanagement-by-modi-govt-for-economic-slowdown-5955560/,27,<praw.models.reddit.submission.SubmissionFlair object at 0x7fcea9d50cc0>
430,IIT Bombay students slam HRD minister for ‘scientific blasphemy’,notautobot,https://timesofindia.indiatimes.com/city/mumbai/iit-bombay-students-slam-hrd-minister-for-scientific-blasphemy/articleshow/70919609.cms,96,<praw.models.reddit.submission.SubmissionFlair object at 0x7fcea9cd70f0>
431,"Is it just me, or is this article somewhat racist?",div_by_zero,https://www.reddit.com/r/india/comments/cyrd02/is_it_just_me_or_is_this_article_somewhat_racist/,6,<praw.models.reddit.submission.SubmissionFlair object at 0x7fcea9cd73c8>
432,bank mergers: View: Why India's mega bank mergers move may not yield the desired results,Indianopolice,https://economictimes.indiatimes.com/industry/banking/finance/banking/view-why-indias-mega-bank-mergers-move-could-backfire/articleshow/70939201.cms,4,<praw.models.reddit.submission.SubmissionFlair object at 0x7fcea9cd7668>
433,Surgeon recommendation for bowleg correction?,un-lightened,https://www.reddit.com/r/india/comments/cykmgl/surgeon_recommendation_for_bowleg_correction/,3,<praw.models.reddit.submission.SubmissionFlair object at 0x7fcea9cd7908>
434,"Woman asked to remove hijab by posh Hyderabad pub, 'no' for kurtis, sarees as well. The unpleasant incident has also brought up the issue of unusually stringent rules set by pubs without taking religious or cultural sentiments into consideration.",aiyyooooo,http://www.newindianexpress.com/cities/hyderabad/2019/aug/31/woman-asked-to-remove-hijab-by-posh-hyderabad-pub-no-for-kurtis-sarees-as-well-2027187.html,61,<praw.models.reddit.submission.SubmissionFlair object at 0x7fcea9cd7ef0>
435,"Indian food fourth most popular in the world, a study of cuisine trade finds",aakash9748,https://theprint.in/world/indian-food-fourth-most-popular-in-the-world-a-study-of-cuisine-trade-finds/283119/,37,<praw.models.reddit.submission.SubmissionFlair object at 0x7fcea9cda208>
436,"An Indian, Jehan Daruvala is currently #2 in the Formula 3 World Driver's Championship standing",cyberspark15,https://www.reddit.com/r/india/comments/cy7loq/an_indian_jehan_daruvala_is_currently_2_in_the/,42,<praw.models.reddit.submission.SubmissionFlair object at 0x7fcea9cda518>
437,"US: Bernie Sanders expresses concern about Kashmir, says India’s actions ‘unacceptable’",jawaharlawl,https://scroll.in/latest/935864/us-bernie-sanders-expresses-concern-on-kashmir-says-indias-actions-unacceptable,199,<praw.models.reddit.submission.SubmissionFlair object at 0x7fcea9cda780>
438,"Chandrayaan-2 enters Moon’s circular orbit, lander-rover separation on Monday.",Blank_eye00,https://timesofindia.indiatimes.com/india/chandrayaan-2-enters-moons-circular-orbit-lander-rover-separation-around-2-pm-today/articleshow/70936576.cms,6,<praw.models.reddit.submission.SubmissionFlair object at 0x7fcea9cdaa58>
439,"Doctor, 73, Beaten To Death By Tea Garden Workers In Assam - NDTV",maniac559,https://www.ndtv.com/india-news/tea-garden-workers-beat-senior-doctor-to-death-in-assams-jorhat-2093794,9,<praw.models.reddit.submission.SubmissionFlair object at 0x7fcea9cdacf8>
440,What does justice mean for a teenaged nun killed 27 years ago in Kerala?,Ajaatshatru34,https://www.thenewsminute.com/article/what-does-justice-mean-teenaged-nun-killed-27-years-ago-kerala-108179,1,<praw.models.reddit.submission.SubmissionFlair object at 0x7fcea9ce6048>
441,"Demonetisation is real culprit behind slowdown, Modi govt is guilty of crippling rural economy",notautobot,https://www.nationalheraldindia.com/opinion/demonetisation-is-real-culprit-behind-slowdown-modi-govt-is-guilty-of-crippling-rural-economy,32,<praw.models.reddit.submission.SubmissionFlair object at 0x7fcea9ce62e8>
442,"[OC] [3937×2319] A Mother with an Umbrella. Kolkata, India.",ritogh,https://i.redd.it/0can00ehs5k31.jpg,0,<praw.models.reddit.submission.SubmissionFlair object at 0x7fcea9ce6588>
443,"On 31 August, the deadline day, a record 49,29,121 e-returns were filed : CBDT",Yay_Yay_3780,https://www.livemint.com/money/personal-finance/on-deadline-day-a-record-49-29-121-itrs-were-filed-on-saturday-1567343420477.html,2,<praw.models.reddit.submission.SubmissionFlair object at 0x7fcea9ce6860>
444,"Apple plans 2-3 brick-and-mortar, an online retail store in India",snicker33,https://www.livemint.com/technology/tech-news/apple-plans-2-3-brick-and-mortar-an-online-retail-store-in-india-1567325174938.html,8,<praw.models.reddit.submission.SubmissionFlair object at 0x7fcea9ce6b00>
445,Help me find a south indian movie/please,popculture_junkie,https://www.reddit.com/r/india/comments/cyd81y/help_me_find_a_south_indian_movieplease/,10,<praw.models.reddit.submission.SubmissionFlair object at 0x7fcea9ce6e48>
446,"prem watsa: I see money coming into India left, right and centre: Prem Watsa",computerbaba7,https://economictimes.indiatimes.com/markets/expert-view/i-see-money-coming-into-india-left-right-and-centre-prem-watsa/articleshow/70941492.cms,11,<praw.models.reddit.submission.SubmissionFlair object at 0x7fcea9cef128>
447,Where and how can I get lamb meat in Mumbai?,gangradem,https://www.reddit.com/r/india/comments/cydvl9/where_and_how_can_i_get_lamb_meat_in_mumbai/,8,<praw.models.reddit.submission.SubmissionFlair object at 0x7fcea9cef3c8>
448,Kashmir is internationalised,Dhruva_K,https://youtu.be/7SZDx0IFmoo,28,<praw.models.reddit.submission.SubmissionFlair object at 0x7fcea9cef6d8>
449,PM Modi launches $4.2 mn redevelopment project of Hindu temple in Bahrain,Vader44,https://www.thehindu.com/news/national/pm-modi-launches-42-mn-redevelopment-project-of-hindu-temple-in-bahrain/article29252060.ece,29,<praw.models.reddit.submission.SubmissionFlair object at 0x7fcea9cef978>
450,[Rant] IRCTC's continued pathetic service amidst move to restore service charges on online ticketing,__shadowfaxx__,https://www.reddit.com/r/india/comments/cyaowl/rant_irctcs_continued_pathetic_service_amidst/,14,<praw.models.reddit.submission.SubmissionFlair object at 0x7fcea9cefc18>
451,"RBI still sitting on huge buffers, present transfer 'grossly inadequate': Goyal",hipporama,https://www.livemint.com/news/india/rbi-still-sitting-on-huge-buffers-present-transfer-grossly-inadequate-goyal-1567191770063.html,6,<praw.models.reddit.submission.SubmissionFlair object at 0x7fcea9cefeb8>
452,'Not Even One Employee Shall Be Removed': Nirmala Sitharaman Allays Fears Of Job Loss After Merger Of Banks,eazywalkers,https://www.outlookindia.com/website/story/india-news-not-even-one-employee-shall-be-removed-nirmala-sitharaman-allays-fears-of-job-loss-after-merger-of-banks/337643,13,<praw.models.reddit.submission.SubmissionFlair object at 0x7fcea9cf4160>
453,"Mukesh Ambani Was First Indian To Get Rolls-Royce Cullinan - The Rs 6.95 Cr, World's Most-Luxurious SUv",Sdgal01,https://m.economictimes.com/magazines/panache/mukesh-ambani-was-first-indian-to-get-rolls-royce-cullinan-the-rs-6-95-cr-worlds-most-luxurious-suv/luxe-on-wheels/slideshow/70907939.cms,12,<praw.models.reddit.submission.SubmissionFlair object at 0x7fcea9cf4400>
454,"Serious question, how many roti(s) do you eat per meal?",AmoebaInYoFace,https://www.reddit.com/r/india/comments/cyab0b/serious_question_how_many_rotis_do_you_eat_per/,43,<praw.models.reddit.submission.SubmissionFlair object at 0x7fcea9cf4710>
455,"I have an African friend, she is from Kenya, she and her friend were told to come to India to work, when they arrived they had their passports taken and now have been told they must prostitute themselves to pay their ‘debt’ before they give them their passports back",MyReddit10001,https://www.reddit.com/r/india/comments/cy0wwi/i_have_an_african_friend_she_is_from_kenya_she/,151,<praw.models.reddit.submission.SubmissionFlair object at 0x7fcea9cf4978>
456,"Kulbhushan Jadhav to get Consular access tomorrow, says Pakistan Foreign Ministry",GL4389,https://indianexpress.com/article/india/kulbhushan-jadhav-to-get-consular-access-tomorrow-says-pakistan-foreign-ministry-5956885/,0,<praw.models.reddit.submission.SubmissionFlair object at 0x7fcea9cf4c18>
457,Old black and white video on village life in South India,shoehouse,https://www.youtube.com/watch?v=vTLcxny7YSg,1,<praw.models.reddit.submission.SubmissionFlair object at 0x7fcea9cf4eb8>
458,"Practically speaking, I am getting Rs 1 crore as a surprise inheritance from a distance child-less uncle, who died. Now, how to live off it, for the rest of my life?",mujhe_nahi_pata,https://www.reddit.com/r/india/comments/cy6pb2/practically_speaking_i_am_getting_rs_1_crore_as_a/,102,<praw.models.reddit.submission.SubmissionFlair object at 0x7fcea9cfd1d0>
459,How easy is it to launch a crowdfunded news site in india,akahorizon,https://www.reddit.com/r/india/comments/cybj6l/how_easy_is_it_to_launch_a_crowdfunded_news_site/,8,<praw.models.reddit.submission.SubmissionFlair object at 0x7fcea9cfd470>
460,Economic slowdown usual during months of Saawan-Bhado: Sushil Kumar Modi,silentr3b3I,https://www.indiatoday.in/india/story/economic-slowdown-usual-during-months-of-saawan-bhado-sushil-kumar-modi-1594317-2019-09-02,1,<praw.models.reddit.submission.SubmissionFlair object at 0x7fcea9cfd710>
461,The girl called Economy,insen2000,https://www.reddit.com/r/india/comments/cy9hj5/the_girl_called_economy/,14,<praw.models.reddit.submission.SubmissionFlair object at 0x7fcea9cfd9b0>
462,"Alwar: A school teacher Ramesh Chand Meena yesterday booked a helicopter to fly back home in Malawali village, 22 km away from the school, on his retirement day. It was my dream to fly in a chopper & to take my wife in a helicopter sojourn. I thoroughly enjoyed it"".",Gavthi_Batman,https://twitter.com/ANI/status/1167893911097921536?s=19,7,<praw.models.reddit.submission.SubmissionFlair object at 0x7fcea9cfdcf8>
463,JNU asks historian Romila Thapar for her CV to evaluate if she can continue as professor emerita,rahulthewall,https://scroll.in/latest/935862/jnu-asks-historian-romila-thapar-for-her-cv-to-evaluate-if-she-can-continue-as-professor-emerita,7,<praw.models.reddit.submission.SubmissionFlair object at 0x7fcea9d06048>
464,"Man kills mother, cooks her brain for refusing money for alcohol",Shellynoire,https://m.mid-day.com/articles/man-kills-mother-cooks-her-brain-for-refusing-money-for-alcohol/21634164,19,<praw.models.reddit.submission.SubmissionFlair object at 0x7fcea9d062e8>
