,title,author,url,num_comments,flair
0,Kashmir News Coverage - 3,gujjuben,https://www.reddit.com/r/india/comments/cyj7gz/kashmir_news_coverage_3/,91,<praw.models.reddit.submission.SubmissionFlair object at 0x7fcebecbce80>
1,"Weekly photography thread thread - September 02, 2019",AutoModerator,https://www.reddit.com/r/india/comments/cyjr1n/weekly_photography_thread_thread_september_02_2019/,22,<praw.models.reddit.submission.SubmissionFlair object at 0x7fceaa83b4e0>
2,Wish immigration was always like this. T3 Delhi.,Sudeep1360,https://i.redd.it/ckvhzawmckk31.jpg,62,<praw.models.reddit.submission.SubmissionFlair object at 0x7fceaa83b438>
3,"‘The most terrifying moments’: India counts down to risky Moon landing | If touchdown is successful, Chandrayaan-2 will be the first lunar mission to explore the south pole.",I1I8I1I,https://www.nature.com/articles/d41586-019-02587-4,179,<praw.models.reddit.submission.SubmissionFlair object at 0x7fceaa83b390>
4,"Bengaluru women march holding clothes they wore while they were sexually harassed. As part of the ‘I Never Ask For It’ walk, youngsters carried clothes that they were wearing when they were sexually harassed.",aiyyooooo,https://www.thenewsminute.com/article/bengaluru-women-march-holding-clothes-they-wore-while-they-were-sexually-harassed-108198,73,<praw.models.reddit.submission.SubmissionFlair object at 0x7fceaa83b358>
5,"In national interest, listen to Manmohan Singh, Shiv Sena tells Centre",sharjeelsayed,https://www.hindustantimes.com/india-news/listen-to-manmohan-singh-s-advice-on-economy-shiv-sena-tells-centre/story-U4tgnjsMp4v4ZS5QxTgyCK.html,33,<praw.models.reddit.submission.SubmissionFlair object at 0x7fceaa83b320>
6,Traffic Fine,sudden_dust,https://i.redd.it/ozi9i0s2nkk31.jpg,31,<praw.models.reddit.submission.SubmissionFlair object at 0x7fceaa83b160>
7,What is a below average guy to do?,Voyager910,https://www.reddit.com/r/india/comments/czk7kj/what_is_a_below_average_guy_to_do/,99,<praw.models.reddit.submission.SubmissionFlair object at 0x7fceaa83b128>
8,"Shiv Sena Activist Accuses Netflix of 'Defaming' Hindus Globally, Files Police Complaint",ab370a1d,https://www.news18.com/news/movies/shiv-sena-activist-files-complaint-against-netflix-for-deep-rooted-hinduphobia-content-2296261.html,29,<praw.models.reddit.submission.SubmissionFlair object at 0x7fceaa83b080>
9,Jio fiber router is security nightmare,Kek567890,https://www.reddit.com/r/india/comments/czl1f1/jio_fiber_router_is_security_nightmare/,37,<praw.models.reddit.submission.SubmissionFlair object at 0x7fceaa83b518>
10,"Delhi Man Surrenders Activa After Police Fines Him Rs 23,000; Says Scooter Cheaper Than Challan",ppatra,https://www.news18.com/news/auto/delhi-man-surrenders-activa-after-police-fines-him-rs-23000-says-scooter-cheaper-than-challan-2295621.html,65,<praw.models.reddit.submission.SubmissionFlair object at 0x7fceaa83b780>
11,BBMP begins road work after video of ‘moon walk’ goes viral,rajeevist,https://www.thehindu.com/news/cities/bangalore/bbmp-begins-road-work-after-video-of-moon-surface-walk-goes-viral/article29326706.ece,24,<praw.models.reddit.submission.SubmissionFlair object at 0x7fceaa83ba20>
12,"Hyderabad: Jealous of friend going to Canada, man sends bomb threat to airport to stop flight",tilismilis,https://www.indiatoday.in/crime/story/hyderabad-friend-canada-man-bomb-threat-airport-flight-1595567-2019-09-04,6,<praw.models.reddit.submission.SubmissionFlair object at 0x7fceaa83bcf8>
13,Aman Dhattarwal's (A Popular Youtuber) brother is missing.Pls share if you live in Delhi,sharmarahulkohli,https://youtu.be/xPM9pzjEWiU,4,<praw.models.reddit.submission.SubmissionFlair object at 0x7fceaa83bf60>
14,"In the Name of Hinduism, People are Boycotting Tea, Food, Fashion, Detergent and all Logic",thewebdev,https://theprint.in/features/in-the-name-of-hinduism-people-are-boycotting-tea-food-fashion-detergent-and-all-logic/285941/,52,<praw.models.reddit.submission.SubmissionFlair object at 0x7fceaa844240>
15,Amazon India to weed out single-use plastic packaging by June 2020.,ppatra,https://www.livemint.com/industry/retail/amazon-india-to-weed-out-single-use-plastic-packaging-by-june-2020-1567579715375.html,9,<praw.models.reddit.submission.SubmissionFlair object at 0x7fceaa844550>
16,BSNL Lay-off,sudden_dust,https://i.redd.it/ij2asfjsllk31.jpg,4,<praw.models.reddit.submission.SubmissionFlair object at 0x7fceaa8447b8>
17,BJP leader Murli Manohar Joshi says India needs a leadership that can argue with PM fearlessly[P],shr612,https://amp.scroll.in/latest/936194/bjp-leader-murli-manohar-joshi-says-india-needs-a-leadership-that-can-argue-with-pm-fearlessly?__twitter_impression=true,39,<praw.models.reddit.submission.SubmissionFlair object at 0x7fceaa844a58>
18,"Kashmir protests get ugly again in London, Indian High Commision targeted",billionaireinindia,https://timesofindia.indiatimes.com/world/uk/kashmir-protests-get-ugly-again-in-london-indian-high-commission-targeted/articleshow/70968542.cms?utm_medium=referral&utm_campaign=iOSapp,107,<praw.models.reddit.submission.SubmissionFlair object at 0x7fceaa844cc0>
19,#BREAKING – @narendramodi govt plans mega publicity blitz on 100 days in office. On September 7th: Top mantris to write editorial in papers. On September 8: Press briefing showcasing govt’s achievements.,hipporama,https://twitter.com/CNNnews18/status/1169150014196789248?s=09,16,<praw.models.reddit.submission.SubmissionFlair object at 0x7fceaa844fd0>
20,"Rs 32,000 challan shocker for auto-rickshaw driver for jumping light, not having papers",sudden_dust,https://m.hindustantimes.com/india-news/man-on-2-wheeler-gets-23k-fine-for-no-helmet-papers-pollution-check/story-3cyrSiFNXunynmSIoSx5CI.html?utm_campaign=fullarticle&utm_medium=referral&utm_source=inshorts,89,<praw.models.reddit.submission.SubmissionFlair object at 0x7fcea9f98278>
21,"Gurugram tractor driver has been fined Rs 59,000 for 10 violations.",sudden_dust,https://mobile.twitter.com/TimesNow/status/1169240071070814209?s=20&utm_campaign=fullarticle&utm_medium=referral&utm_source=inshorts,11,<praw.models.reddit.submission.SubmissionFlair object at 0x7fcea9f98588>
22,"Lunch Today - Rice, Fish and Vegetables",thewebdev,https://i.redd.it/s1rdgkfnmlk31.jpg,30,<praw.models.reddit.submission.SubmissionFlair object at 0x7fcea9f98a20>
23,"Gurugram: Three auto-rickshaw drivers charged Rs 9,400, Rs 27,000 and Rs 37,000 as challan by Gurugram Traffic Police for violating traffic rules, today. ACP (crime) Shamsher Singh says, ""challans being issued under provisions of Motor Vehicles (Amendment) Act, 2019"".[NP]",shr612,https://mobile.twitter.com/ANI/status/1169217168623296512,34,<praw.models.reddit.submission.SubmissionFlair object at 0x7fcea9f98cc0>
24,"""Pak Desperate To Push Terrorists Into J&K, 2 With LeT Ties Caught"": Army",Greatfool19000,https://www.ndtv.com/india-news/pakistan-desperate-to-push-terrorists-into-kashmir-valley-2-with-let-links-caught-army-2095427?pfrom=home-livetv,6,<praw.models.reddit.submission.SubmissionFlair object at 0x7fcea9f98fd0>
25,"Leila IMDb reviews: We're the most tolerant people, so we'll give 1 star to express our tolerance",ChumbaWambah,https://i.imgur.com/sPT3GzK.jpg,40,<praw.models.reddit.submission.SubmissionFlair object at 0x7fcea9fa0320>
26,Why are the Indian government and ratings agencies not taking the economic slowdown more seriously?,ponniyin_selvan,https://scroll.in/article/936181/why-are-the-indian-government-and-ratings-agencies-not-taking-the-economic-slowdown-more-seriously,2,<praw.models.reddit.submission.SubmissionFlair object at 0x7fcea9fa05c0>
27,"India has moved up 6 places on World Travel and Tourism Competitiveness Index, with 40th rank in 2017 to 34th in 2019, as per World Economic Forum report.",SumoneSumwere,https://i.redd.it/yvg0gyqchlk31.jpg,3,<praw.models.reddit.submission.SubmissionFlair object at 0x7fcea9fa0860>
28,Late Night Random Discussion Thread !,oxythebot,https://www.reddit.com/r/india/comments/czmlrm/late_night_random_discussion_thread/,1214,<praw.models.reddit.submission.SubmissionFlair object at 0x7fcea9fa0cc0>
29,"Telangana man forced to carry 7-yr-old daughter's dead body as hospital refuses ambulance. Unable to afford a private vehicle, the man had to carry his dead daughter because the hospital authorities did not provide him an ambulance.",aiyyooooo,https://www.indiatoday.in/india/story/telangana-man-forced-to-carry-7-yr-old-daughter-s-dead-body-as-hospital-refuses-ambulance-1594726-2019-09-03,20,<praw.models.reddit.submission.SubmissionFlair object at 0x7fcea9fa0fd0>
30,Heavy fines!,sudden_dust,https://i.redd.it/wdkv75x14hk31.jpg,142,<praw.models.reddit.submission.SubmissionFlair object at 0x7fcea9faa320>
31,"Porn Star's ""Shout Out"" To Ex-Pak Envoy To India After Twitter Gaffe",thelielmao,https://www.ndtv.com/world-news/adult-filmstar-johny-sins-on-ex-pak-envoy-abdul-basits-goof-up-thanks-but-my-vision-is-fine-2095346,1,<praw.models.reddit.submission.SubmissionFlair object at 0x7fcea9faa668>
32,"Intelligence Failure led to Pulwama Terror Attack, finds CRPF Internal Inquiry",thewebdev,https://www.nationalheraldindia.com/india/pulwama-terror-attack-was-due-to-intelligence-failure-finds-crpf-internal-inquiry,23,<praw.models.reddit.submission.SubmissionFlair object at 0x7fcea9faa908>
33,350 km in 5 hours: TN boy rushed for emergency surgery,shivram93,https://www.thehindu.com/news/national/tamil-nadu/over-350-km-in-5-hours-tn-boy-rushed-for-emergency-surgery/article29328695.ece,0,<praw.models.reddit.submission.SubmissionFlair object at 0x7fcea9faaba8>
34,Why upper castes polish shoes or sweep roads when protesting quota for Dalits and OBCs,damnjimmie,https://theprint.in/opinion/why-upper-castes-polish-shoes-or-sweep-roads-when-protesting-quota-for-dalits-and-obcs/286243/?fbclid=IwAR37vPG6jftJBE0V51Z1oo6wjnQ43YhSTVVxpayANGq8u0sBXmFwYxCen7E,2,<praw.models.reddit.submission.SubmissionFlair object at 0x7fcea9faae10>
35,"India's Economy Suffers Car Crash, Pain Spreads To Villages",GlobalCitizen12345,https://www.ndtv.com/india-news/indias-economy-suffers-car-crash-pain-spreads-to-villages-2095449,3,<praw.models.reddit.submission.SubmissionFlair object at 0x7fcea9fb20f0>
36,"India to manufacture spare parts, components for Russian defence equipments",NOLUSUG,https://www.thehindu.com/news/national/india-to-manufacture-spare-parts-components-for-russian-defence-equipment/article29334427.ece,0,<praw.models.reddit.submission.SubmissionFlair object at 0x7fcea9fb2390>
37,'They Thought He Was Muslim': Kin of Boy Beaten to Death in Delhi,anticholinergic,https://www.thequint.com/news/india/they-thought-he-was-muslim-family-of-boy-killed-in-east-delhi,33,<praw.models.reddit.submission.SubmissionFlair object at 0x7fcea9fb25f8>
38,"‘BJP mole’ Praveen Chakravarty, the data cell head blamed for Congress loss, gets promoted",I_call_it,https://theprint.in/politics/bjp-mole-praveen-chakravarty-the-data-cell-head-blamed-for-congress-loss-gets-promoted/286587/,4,<praw.models.reddit.submission.SubmissionFlair object at 0x7fcea9fb2898>
39,Kashmiri student based in Bangalore files petition before the Karnataka HC against communication shutdown,InternetFreedomIn,https://www.reddit.com/r/india/comments/czgkia/kashmiri_student_based_in_bangalore_files/,33,<praw.models.reddit.submission.SubmissionFlair object at 0x7fcea9fb2ba8>
40,Askindia Edition - What's the only reason that holds you on to live the remaining of your life despite the fact you are depressed and tired of living?,_RandomRedditor,https://www.reddit.com/r/india/comments/czlnnd/askindia_edition_whats_the_only_reason_that_holds/,30,<praw.models.reddit.submission.SubmissionFlair object at 0x7fcea9fb2e80>
41,An Old Photo of Nitin Gadkari Riding Scooter Without Helmet Has Triggered Online Petition,hipporama,https://www.news18.com/amp/news/buzz/an-old-photo-of-nitin-gadkari-riding-scooter-without-helmet-has-triggered-online-petition-2296179.html?__twitter_impression=true,1,<praw.models.reddit.submission.SubmissionFlair object at 0x7fcea9fba160>
42,Any Movie Actor/Actress that has openly spoken against the caste system or castiesm?,NJMD,https://www.reddit.com/r/india/comments/czndu6/any_movie_actoractress_that_has_openly_spoken/,17,<praw.models.reddit.submission.SubmissionFlair object at 0x7fcea9fba3c8>
43,"Discontent, dissent & defiance in Congress as Gandhi family begins to lose grip on party",I_call_it,https://theprint.in/politics/discontent-dissent-defiance-in-congress-as-gandhi-family-begins-to-lose-grip-on-party/286169/,22,<praw.models.reddit.submission.SubmissionFlair object at 0x7fcea9fba668>
44,My career is ruined.,bambi-91,https://www.reddit.com/r/india/comments/cznj3t/my_career_is_ruined/,33,<praw.models.reddit.submission.SubmissionFlair object at 0x7fcea9fba908>
45,"Andhra Pradesh doctor, family kill self after losing Rs 5.5cr in 'rice pulling con' | Visakhapatnam News -",hauntin,https://m.timesofindia.com/city/visakhapatnam/andhra-pradesh-doctor-family-kill-self-after-losing-rs-5-5cr-in-rice-pulling-con/articleshow/70967039.cms,21,<praw.models.reddit.submission.SubmissionFlair object at 0x7fcea9fbabe0>
46,"Cartoonscape — September 4, 2019, The Hindu",Vader44,https://i.redd.it/grc5o5r4iik31.jpg,8,<praw.models.reddit.submission.SubmissionFlair object at 0x7fcea9fbae80>
47,India Today investigation exposes the rot in the Ayushman Bharat Scheme. #OperationModicare #ITLivestream,silentr3b3I,https://twitter.com/IndiaToday/status/1169225347532873728,2,<praw.models.reddit.submission.SubmissionFlair object at 0x7fcea9fc6160>
48,Andhra Pradesh: Dalit MLA stopped from entering Ganesh pandal,desolationismyfriend,https://www.msn.com/en-in/news/other/andhra-pradesh-dalit-mla-stopped-from-entering-ganesh-pandal/ar-AAGKuHu,12,<praw.models.reddit.submission.SubmissionFlair object at 0x7fcea9fc64a8>
49,India Builds Largest Detention Centre For Those Excluded from NRC,ScumOfThePlanet,https://www.thequint.com/videos/news-videos/india-largest-detention-centre-in-matia-assam-for-those-excluded-from-nrc-list?utm_source=Twitter&h=AT3Y2WR3keQOuSK2IVwRmGlj7dlfXztlIc52LmnERhs5ZwLmqucZbl9sHE8KPdQ28qIQgsi5tL-9r8Ty8Hna_h09J712I0GmjKrpm_f4fen2SqhD1DYUp772yNeEmcmNine824ZnIG1l8ngxbD_gEH-DDm28oCeo28he_dK7NgzeLVyC75gczRIaw7a6owe2WRPZiAd0NYMuAuGwwavFnkCPyqXXMKrSkbKsPxSurVlJIG8nE6i73VmOzcQvKXby_bSjjiUTbvas7_IjOGThYpyVygxi4ZD5VI-vTGhB3DCq8OzhewQ1ajw2x69Q32UAuScSIulXEryGe8ySmnNW-bGXJZl2RITs4gArK04ICd-Eu_xLanP2XsyvIbezLT0vke8l98BCcPocmjR8VXJlAjYjbXtX74ou1YzY1Ju4Q7xnP0GnCfjykIzyyEPf_1e59Yw0PkKloSXz30J5os4YfzlOigrl0tLnaIHtoyEArd-wYcMudZYYAwfy809mhJmy7j3UoSvS4xn7mmfteLTMH9ZY8C4YHDye5B3pvdoV1yIiqP2CAk83VnCr0v7NmAW6WaKrB-WxIHQA94gDifuSAro4PvhhSv-htKz6l7flkGET_UhbH4fmTwpc4NRaBY7z6TkPPnEMtxtrV4rLYSuUCNIftpdEac8LbrCj9VLUUne6LFvaC5WAQMCQTdOAXS5hu24C2JBfqGYR2YEwwjvOozOsC2Vdq2L29QC2R7dc02hJvJ_G76BptkBRjuOupDlHn4kEwb_qxozf9gD8pNHPkx0VFi9qegBUHxsBcuDl5M_RudQgl8KrVLCoWVPNjMQf5OjGK2BuOm5puGhThCUllEwhlQKhjXTQncqXwk-WTNQlekkQYFvUNpz2Uv1AScMzRXiwOZ52VJFcK8sXKucQZc945bn-aTD9oSzN_xCx9w1QTgxBQOkPjFq03cw2sYZsq7Q63U2yFJaqyo_cskyebgZiCIsrtslpn12zr3lfH6bCDzgzuYXeiW_n3m-HuXIpil9DmteJAh2LlBJR24VQHS23Ba-_QJdz,4,<praw.models.reddit.submission.SubmissionFlair object at 0x7fcea9fc67b8>
50,"Andhra Pradesh government starts taking over liquor business | The AP govt plans to reduce the number of liquor outlets from 4,380 to 3,500 and eventually phase them out. - The govt-run shops will operate from 10 am to 9 pm. They will not sell more than three alcohol bottles to a customer",aiyyooooo,https://www.livemint.com/industry/manufacturing/andhra-pradesh-government-starts-taking-over-liquor-business-1567479898353.html,9,<praw.models.reddit.submission.SubmissionFlair object at 0x7fcea9fc6a58>
51,Found this in a drawer I was cleaning out. Fs in the chat,7heGh0st,https://i.redd.it/khyic2ew6fk31.jpg,158,<praw.models.reddit.submission.SubmissionFlair object at 0x7fcea9fc6d30>
52,"Up To 10 Years' Jail Proposed For Violence Against Doctors In Draft Bill | The Health Ministry has asked for feedback from the public on draft Healthcare Service Personnel and Clinical Establishments (Prohibition of Violence and Damage to Property) Bill, 2019",I1I8I1I,https://www.ndtv.com/india-news/jail-for-up-to-10-years-proposed-for-violence-against-doctors-and-healthcare-personnel-in-draft-bill-2094694,46,<praw.models.reddit.submission.SubmissionFlair object at 0x7fcea9fc6fd0>
53,Maruti Suzuki to Shut Down Gurugram and Manesar Plant for 2 Days Amidst Sales Decline,ScumOfThePlanet,https://www.news18.com/news/auto/maruti-suzuki-announces-to-shutdown-production-plants-for-2-days-to-meet-demand-2296485.html,12,<praw.models.reddit.submission.SubmissionFlair object at 0x7fcea9fcf2b0>
54,"Kashmiri teen dies of injuries at Srinagar hospital, restrictions re-imposed.",ccrackacoldone,https://www.indiatoday.in/india/story/kashmir-man-dies-protest-injuries-srinagar-restrictions-1595368-2019-09-04,0,<praw.models.reddit.submission.SubmissionFlair object at 0x7fcea9fcf5f8>
55,India May Have Entered ‘Quasi-Recession’ as GDP Growth Plummets - BNN Bloomberg,CommunistIndia,https://www.bnnbloomberg.ca/india-may-have-entered-quasi-recession-as-gdp-growth-plummets-1.1310203,7,<praw.models.reddit.submission.SubmissionFlair object at 0x7fcea9fcf940>
56,"Pakistan lacks evidence to prove 'genocide' in Kashmir, says its ICJ lawyer",Random_769,https://www.livemint.com/news/india/pakistan-lacks-evidence-to-prove-genocide-in-kashmir-says-its-icj-lawyer-1567514728481.html,7,<praw.models.reddit.submission.SubmissionFlair object at 0x7fcea9fcfda0>
57,"LIC loses over Rs 17,000 cr in PSBs since June-quarter last year",pramodc84,https://www.thehindubusinessline.com/money-and-banking/lic-has-lost-over-rs-17000-cr-of-wealth-in-psu-banks-since-june-quarter-last-year/article29330300.ece?homepage=true,5,<praw.models.reddit.submission.SubmissionFlair object at 0x7fcea9f540b8>
58,HC judge withdraws from hearing of Sanjiv Bhatt's bail plea,vectrum,http://www.newindianexpress.com/nation/2019/sep/03/not-before-me-hc-judge-withdraws-from-hearing-of-sanjiv-bhatts-bail-plea-2028431.html?fbclid=IwAR0BbwEAoHY5ZxTBlpN-eoJr06KNN9xGtHNqO6r8R5s2wueDm0yuF83U8qI,0,<praw.models.reddit.submission.SubmissionFlair object at 0x7fcea9f543c8>
59,"Electricity bills set to rise in UP, up to 12% power tariff hike approved",HoeYouknowme,https://www.livemint.com/industry/energy/electricity-bills-set-to-rise-in-up-up-to-12-power-tariff-hike-approved-1567524085092.html,30,<praw.models.reddit.submission.SubmissionFlair object at 0x7fcea9f54668>
60,"35 yo Neighbor is educated only up to 10th, wants to clear HSC. How do I help him?",Bumbastical,https://www.reddit.com/r/india/comments/czi675/35_yo_neighbor_is_educated_only_up_to_10th_wants/,2,<praw.models.reddit.submission.SubmissionFlair object at 0x7fcea9f54940>
61,My ears are gonna split!,AfzalOzil360,https://www.reddit.com/r/india/comments/czhn0k/my_ears_are_gonna_split/,15,<praw.models.reddit.submission.SubmissionFlair object at 0x7fcea9f54c18>
62,Humble request,lazystonedmonkey,https://www.reddit.com/r/india/comments/czjggo/humble_request/,18,<praw.models.reddit.submission.SubmissionFlair object at 0x7fcea9f54f28>
63,Video of Apple Tree Felling in Shimla Being Used to Spread Fake Propaganda on J&K,tfirdt,https://himachalwatcher.com/2019/09/04/video-of-apple-tree-felling-in-shimla-being-used-to-spread-fake-propaganda-on-jk/,1,<praw.models.reddit.submission.SubmissionFlair object at 0x7fcea9f601d0>
64,"Ditching the dollar: National currency payments key to boosting Russia-India trade, says Putin — RT Business News",GlobalCitizen12345,https://www.rt.com/business/467954-russia-india-currencies-trade/,5,<praw.models.reddit.submission.SubmissionFlair object at 0x7fcea9f604e0>
65,Are mainstream indian news channels talking about economic slowdown?,willchangenamesoon,https://www.reddit.com/r/india/comments/czmtcz/are_mainstream_indian_news_channels_talking_about/,1,<praw.models.reddit.submission.SubmissionFlair object at 0x7fcea9f60748>
66,Nagpur Police Social Media team using MKBHD meme format to spread awareness.,Lowcrbnaman,https://i.redd.it/9yo9vqx1glk31.jpg,4,<praw.models.reddit.submission.SubmissionFlair object at 0x7fcea9f609e8>
67,Government Forcing Media to Speak in Their Support: Mrinal Pande,silentr3b3I,https://www.thequint.com/videos/news-videos/government-forcing-media-to-speak-in-their-support-mrinal-pande,0,<praw.models.reddit.submission.SubmissionFlair object at 0x7fcea9f60c88>
68,What is the deal with the catering/ bedding staff in Rajdhani express asking for money.,Emalianenko,https://www.reddit.com/r/india/comments/czhva3/what_is_the_deal_with_the_catering_bedding_staff/,13,<praw.models.reddit.submission.SubmissionFlair object at 0x7fcea9f60f60>
69,Bombay HC says SEBI has committed error rejecting NDTV’s delay in filing settlement applications,ponniyin_selvan,https://scroll.in/latest/936286/bombay-hc-says-sebi-has-committed-error-rejecting-ndtvs-delay-in-filing-settlement-applications,0,<praw.models.reddit.submission.SubmissionFlair object at 0x7fcea9f6a240>
70,"Smashing gender bias: Sindhu, Saina tracing their own paths, not chasing male records",koonkumar,https://indianexpress.com/article/opinion/columns/pv-sindhu-sania-nehwal-badminton-smashing-gender-bias-5960039/,3,<praw.models.reddit.submission.SubmissionFlair object at 0x7fcea9f6a4e0>
71,The unusual transfer of Madras High Court Chief Justice Tahilramani to Meghalaya,charavaka,https://www.telegraphindia.com/india/the-unusual-transfer-of-madras-high-court-chief-justice-tahilramani-to-meghalaya/cid/1701807,0,<praw.models.reddit.submission.SubmissionFlair object at 0x7fcea9f6a780>
72,"Dalit MLA from AP visits Ganesh pandal, faces casteist abuses for ‘polluting’ deity",Vader44,https://www.thenewsminute.com/article/dalit-mla-ap-visits-ganesh-pandal-faces-casteist-abuses-polluting-deity-108300,10,<praw.models.reddit.submission.SubmissionFlair object at 0x7fcea9f6aa90>
73,Pakistan allows trade of life saving drugs with India,computerbaba7,https://www.indiatoday.in/business/story/pakistan-allows-trade-life-saving-drugs-with-india-1594943-2019-09-03,146,<praw.models.reddit.submission.SubmissionFlair object at 0x7fcea9f6ad68>
74,Indian High Commission in UK vandalised by Pakistani supporters; London Mayor says ‘unacceptable’,computerbaba7,https://www.timesnownews.com/india/article/indian-high-commission-in-uk-vandalised-by-pakistani-supporters-london-mayor-says-unacceptable/482127,10,<praw.models.reddit.submission.SubmissionFlair object at 0x7fcea9f71048>
75,"Heavy rainfall and flooding in Mumbai , September 4th",thankred,https://youtu.be/XboK4s5f2zA,0,<praw.models.reddit.submission.SubmissionFlair object at 0x7fcea9f712e8>
76,"[For economic majors] Ahead of Brexit, is it a good idea to apply for Master's in the UK?",mmddev,https://www.reddit.com/r/india/comments/cznf0f/for_economic_majors_ahead_of_brexit_is_it_a_good/,2,<praw.models.reddit.submission.SubmissionFlair object at 0x7fcea9f715f8>
77,Cashless Prosperity: Will 2019 be India's Worst Diwali?,DkodingOfficial,https://www.dkoding.in/newsline/cashless-prosperity-will-2019-be-indias-worst-diwali/,0,<praw.models.reddit.submission.SubmissionFlair object at 0x7fcea9f71898>
78,"UP: Rickshaw puller from Delhi who lured women on Facebook with fake Facebook ID of IPS officer, held | Bareilly News - Times of India",morlock77,https://timesofindia.indiatimes.com/city/bareilly/rickshaw-puller-who-lured-women-on-facebook-with-fake-id-of-ips-officer-held/articleshow/70966755.cms,9,<praw.models.reddit.submission.SubmissionFlair object at 0x7fcea9f71b00>
79,"10 Killed, Many Trapped After Explosion At Firecracker Factory In Punjab's Gurdaspur",computerbaba7,https://www.ndtv.com/india-news/explosion-at-firecracker-factory-in-punjabs-gurdaspur-50-feared-trapped-2095580,0,<praw.models.reddit.submission.SubmissionFlair object at 0x7fcea9f71f28>
80,US clothing companies push for India-US FTA for greater engagement,pramodc84,https://www.thehindubusinessline.com/economy/policy/us-clothing-companies-push-for-india-us-fta-for-greater-engagement/article29330943.ece?homepage=true,4,<praw.models.reddit.submission.SubmissionFlair object at 0x7fcea9f78208>
81,"Freedom struggle was an NRI movement, says Rahul Gandhi",GunduAshoka,https://www.thehindubusinessline.com/news/national/freedom-struggle-was-an-nri-movement-says-rahul-gandhi/article9867744.ece,11,<praw.models.reddit.submission.SubmissionFlair object at 0x7fcea9f78550>
82,18 buildings damaged as Kolkata Metro tunnel-borer ‘hits aquifer’,ppatra,https://m.timesofindia.com/city/kolkata/18-buildings-damaged-as-kolkata-metro-tunnel-borer-hits-aquifer/articleshow/70940550.cms,7,<praw.models.reddit.submission.SubmissionFlair object at 0x7fcea9f787f0>
83,Out of almost 1000 Rupees with no service or refund from Hathway,f_sha,https://www.reddit.com/r/india/comments/czh4pw/out_of_almost_1000_rupees_with_no_service_or/,16,<praw.models.reddit.submission.SubmissionFlair object at 0x7fcea9f78a90>
84,Job Help,Pratik5211,https://www.reddit.com/r/india/comments/czhid4/job_help/,9,<praw.models.reddit.submission.SubmissionFlair object at 0x7fcea9f78e48>
85,I have a flight to catch at 10.30 PM. But can't move out of my area due to rains. Can I reschedule my ticket somehow?,kingslayyer,https://www.reddit.com/r/india/comments/cziid8/i_have_a_flight_to_catch_at_1030_pm_but_cant_move/,4,<praw.models.reddit.submission.SubmissionFlair object at 0x7fcea9f84128>
86,"In 1961, India Finally Kicked Portugal off the Subcontinent [Old]",UngilUndy,https://warisboring.com/in-1961-india-finally-kicked-portugal-off-the-subcontinent/,6,<praw.models.reddit.submission.SubmissionFlair object at 0x7fcea9f843c8>
87,BSNL Cellone users?,ingenioutor,https://www.reddit.com/r/india/comments/czoouc/bsnl_cellone_users/,0,<praw.models.reddit.submission.SubmissionFlair object at 0x7fcea9f84668>
