,title,author,url,num_comments,flair
560,Jio GigaFiber - Will the Commercial Plans for Offices provide static ip addresses?,nikhilb_it,https://www.reddit.com/r/india/comments/cy99xb/jio_gigafiber_will_the_commercial_plans_for/,0,<praw.models.reddit.submission.SubmissionFlair object at 0x7fcea9c29d68>
561,IIM Indore to offer voluntary course on Sanskrit,meekaa_saangoo,https://www.thehindu.com/education/iim-indore-to-offer-voluntary-course-on-sanskrit/article29310334.ece,2,<praw.models.reddit.submission.SubmissionFlair object at 0x7fcea9c31048>
562,Amaravati: Andhra Pradesh govt to paint panchayat buildings in party colours. The colour scheme of the panchayat buildings is similar to the YSR Congress Party's (YSRCP) flag colours.,aiyyooooo,https://www.indiatoday.in/india/story/andhra-pradesh-ysrcp-panchayat-buildings-flag-colours-1593687-2019-08-30,5,<praw.models.reddit.submission.SubmissionFlair object at 0x7fcea9c31320>
563,Planning to move out - how hard is it to rent a house/apartment as a single male?,chaininglinks,https://www.reddit.com/r/india/comments/cy6jgq/planning_to_move_out_how_hard_is_it_to_rent_a/,1,<praw.models.reddit.submission.SubmissionFlair object at 0x7fcea9c31588>
564,Queensland extinguishes native title over Indigenous land to make way for Adani coalmine,anarco_syndical,https://www.theguardian.com/business/2019/aug/31/queensland-extinguishes-native-title-over-indigenous-land-to-make-way-for-adani-coalmine,5,<praw.models.reddit.submission.SubmissionFlair object at 0x7fcea9c31828>
565,Bibek Debroy speaks at the India Economic Conclave 2019 | ET NOW,Ilovemachines,https://www.youtube.com/watch?v=QFxuC7M8EIE,0,<praw.models.reddit.submission.SubmissionFlair object at 0x7fcea9c31b00>
566,Hi India. I'm going to interview a sage tomorrow regarding Dharma in the Bhagavad Gita. Do you want me to ask him anything regarding this topic from your side?,Journal2017,https://www.reddit.com/r/india/comments/cxyxng/hi_india_im_going_to_interview_a_sage_tomorrow/,32,<praw.models.reddit.submission.SubmissionFlair object at 0x7fcea9c31e10>
567,Why Neither India Nor Pakistan Can Risk A Nuclear War | TOI,AfzalOzil360,https://m.timesofindia.com/india/why-neither-india-nor-pakistan-can-risk-a-nuclear-war/articleshow/70908000.cms,4,<praw.models.reddit.submission.SubmissionFlair object at 0x7fcea9c3b198>
568,"Kerala: Class 7 student pregnant, teacher accused of rape",aiyyooooo,https://www.deccanchronicle.com/nation/crime/250819/kerala-class-7-student-pregnant-teacher-accused-of-rape.html,4,<praw.models.reddit.submission.SubmissionFlair object at 0x7fcea9c3b4e0>
569,Help with female colleague.,AfterScholar,https://www.reddit.com/r/india/comments/cxvzut/help_with_female_colleague/,60,<praw.models.reddit.submission.SubmissionFlair object at 0x7fcea9c3b7b8>
570,As a salaried person what should we do in the current economic slowdown facing our country,damnjimmie,https://www.reddit.com/r/india/comments/cxypdz/as_a_salaried_person_what_should_we_do_in_the/,1,<praw.models.reddit.submission.SubmissionFlair object at 0x7fcea9c3bac8>
571,"42 years in making, Jharkhand canal collapses 24 hours after opening.",Gavthi_Batman,https://timesofindia.indiatimes.com/city/ranchi/42-years-in-making-jharkhand-canal-collapses-24-hours-after-opening/articleshow/70918808.cms,35,<praw.models.reddit.submission.SubmissionFlair object at 0x7fcea9c3bd30>
572,"NRC final list: BJP worried over exclusion of Hindus, inclusion of illegal Bangladeshi Muslims",Fluttershy_qtest,https://www.indiatoday.in/india/story/nrc-final-list-bjp-worried-over-exclusion-of-hindus-inclusion-of-illegal-bangladeshi-muslims-1593966-2019-08-31,7,<praw.models.reddit.submission.SubmissionFlair object at 0x7fcea9c3bf98>
573,"Retired Army Officer Mohammad Sanaullah not in NRC Final List, Says ‘expected the same’",thewebdev,https://www.nationalheraldindia.com/india/retired-army-officer-mohammad-sanaullah-not-in-nrc-final-list-says-expected-the-same,8,<praw.models.reddit.submission.SubmissionFlair object at 0x7fcea9c422b0>
574,Not getting the promised data limit on Jio [np],devtan178,https://www.reddit.com/r/india/comments/cxy9zu/not_getting_the_promised_data_limit_on_jio_np/,6,<praw.models.reddit.submission.SubmissionFlair object at 0x7fcea9c42550>
575,Now ‘revolving-door’ arrests in Kashmir,madamplease,https://www.thehindu.com/news/national/now-revolving-door-arrests-in-kashmir/article29310428.ece?homepage=true,2,<praw.models.reddit.submission.SubmissionFlair object at 0x7fcea9c427b8>
576,"BJP To Observe ""Service Week"" For PM Modi's Good Health",thisappear,https://www.ndtv.com/india-news/pm-narendra-modi-birthday-2019-bjp-to-observe-service-week-for-pm-narendra-modis-good-health-2093677,8,<praw.models.reddit.submission.SubmissionFlair object at 0x7fcea9c42a58>
577,I am attending a Hindu Wedding tonight as part of the groom's party. What songs should I learn the dances to?,42Fab_com,https://www.reddit.com/r/india/comments/cy9vyp/i_am_attending_a_hindu_wedding_tonight_as_part_of/,7,<praw.models.reddit.submission.SubmissionFlair object at 0x7fcea9c42cc0>
578,"GATE 2020 application form released by IIT Delhi: Check how to apply, eligibility, exam pattern",anshulkush,https://indianexpress.com/article/education/gate-2020-application-form-released-by-iit-delhi-check-how-to-apply-eligibility-exam-pattern-gate-iitd-ac-in-5954469/lite/?__twitter_impression=true,0,<praw.models.reddit.submission.SubmissionFlair object at 0x7fcea9c42f28>
579,"150 dogs poisoned, some buried alive by Hyderabad Municipal (GHMC): Animal rights activists allege. The dog carcasses were thrown into a pit that was kept ready. Some of the dogs were still alive and one managed to escape, an eyewitness said.",aiyyooooo,https://www.thenewsminute.com/article/150-dogs-poisoned-some-buried-alive-ghmc-animal-rights-activists-hyd-allege-108121,68,<praw.models.reddit.submission.SubmissionFlair object at 0x7fcea9c4a208>
580,How do you think of religion in India?,SudSuryawanshi,https://www.reddit.com/r/india/comments/cy15ta/how_do_you_think_of_religion_in_india/,9,<praw.models.reddit.submission.SubmissionFlair object at 0x7fcea9c4a518>
581,"India leaves nearly two million people off citizens' list, fate uncertain",poclee,https://www.reuters.com/article/us-india-politics-citizenship/india-leaves-nearly-two-million-people-off-citizens-list-fate-uncertain-idUSKCN1VL04W,36,<praw.models.reddit.submission.SubmissionFlair object at 0x7fcea9c4a898>
582,"Married redditors, Is it worth having a child in India if you're a middle class man?",lifeof3point14,https://www.reddit.com/r/india/comments/cxt2jj/married_redditors_is_it_worth_having_a_child_in/,89,<praw.models.reddit.submission.SubmissionFlair object at 0x7fcea9c4ab00>
583,"Not Oxford English, anti-Modi stand helped Congress-UDF victory: Muraleedharan attacks Shashi Tharoor",Sanniry,https://www.indiatoday.in/india/story/oxford-english-anti-modi-stand-congress-udf-victory-muraleedharan-shashi-tharoor-1593985-2019-09-01,0,<praw.models.reddit.submission.SubmissionFlair object at 0x7fcea9c4ad68>
584,Honest question: Does wearing genuine leather bother Indians in the office (in America/etc) ?,SexualMetawhore,https://www.reddit.com/r/india/comments/cxvj2x/honest_question_does_wearing_genuine_leather/,19,<praw.models.reddit.submission.SubmissionFlair object at 0x7fcea9bd5048>
585,Is it common in India to message random people on Facebook to make friends?,dont_mess_with_tx,https://www.reddit.com/r/india/comments/cy2a8h/is_it_common_in_india_to_message_random_people_on/,4,<praw.models.reddit.submission.SubmissionFlair object at 0x7fcea9bd52e8>
586,I have an opportunity to do a part time. My concern is can my current employee find out about part time using TDS or form 16.,585987448205,https://www.reddit.com/r/india/comments/cxwrot/i_have_an_opportunity_to_do_a_part_time_my/,7,<praw.models.reddit.submission.SubmissionFlair object at 0x7fcea9bd5668>
587,"Mukesh Ambani hailed Amit Shah as a “true karmayogi” and “Iron Man” in what appeared to be a ringing endorsement of the ascendancy of the home minister, already seen in Delhi’s power corridors as PM Modi’s “natural successor”.",Gavthi_Batman,https://twitter.com/ttindia/status/1167716151150825473?s=19,17,<praw.models.reddit.submission.SubmissionFlair object at 0x7fcea9bd59b0>
588,"Do people who work in scam call centers, fake tech support gift card give away knows that they are scamming?",zaxyepomme,https://www.reddit.com/r/india/comments/cy2jjl/do_people_who_work_in_scam_call_centers_fake_tech/,9,<praw.models.reddit.submission.SubmissionFlair object at 0x7fcea9bd5c50>
589,"Gujarat: Housing Society Asks Members Not to Sell Property to Dalits, Muslims",chotu_ustaad,https://thewire.in/rights/gujarat-housing-society-property-dalits-muslims,5,<praw.models.reddit.submission.SubmissionFlair object at 0x7fcea9bd5ef0>
590,"Devendra Fadnavis Pushed Police To Open Accounts In Axis Bank, Where Wife Is VP, Alleges Petition",mr-kashyap,https://www.huffingtonpost.in/entry/devendra-fadnavis-pushed-police-to-open-accounts-in-axis-bank-where-wife-is-vp-alleges-petition_in_5d681e58e4b02bc6bb36934c,10,<praw.models.reddit.submission.SubmissionFlair object at 0x7fcea9bdc1d0>
591,How can I seek help for someone who is experiencing Domestic Violence?,pichaku97,https://www.reddit.com/r/india/comments/cxwhc9/how_can_i_seek_help_for_someone_who_is/,3,<praw.models.reddit.submission.SubmissionFlair object at 0x7fcea9bdc438>
592,HDIL files for insolvency [R],High24x7,https://i.imgur.com/GT2s8yF.jpg,2,<praw.models.reddit.submission.SubmissionFlair object at 0x7fcea9bdc828>
593,Newly-wed woman leaves husband ‘occupied’ with competitive exams,meekaa_saangoo,https://www.thehindu.com/news/national/other-states/newly-wed-woman-leaves-husband-occupied-with-competitive-exams/article29307908.ece,5,<praw.models.reddit.submission.SubmissionFlair object at 0x7fcea9bdcac8>
594,Maharashtra: 13 dead in explosion at chemical unit in Dhule district,GL4389,https://indianexpress.com/article/india/maharashtra-chemical-factory-explosion-live-updates-dhule-district-5953407/,1,<praw.models.reddit.submission.SubmissionFlair object at 0x7fcea9bdcd68>
595,"Going to Jakarta, have three questions :)",sangupta637,https://www.reddit.com/r/india/comments/cxzj0v/going_to_jakarta_have_three_questions/,10,<praw.models.reddit.submission.SubmissionFlair object at 0x7fcea9bdcfd0>
596,How long does it take to develop a habit of drinking beer? And ideas for disposing the bottle secretly?,paperbag108,https://www.reddit.com/r/india/comments/cy9p5w/how_long_does_it_take_to_develop_a_habit_of/,9,<praw.models.reddit.submission.SubmissionFlair object at 0x7fcea9be52b0>
597,"11th Century Stepwell, Rankivav, Patan, Gujarat",janijanmejay,https://i.redd.it/rcvsf38h3sj31.jpg,1,<praw.models.reddit.submission.SubmissionFlair object at 0x7fcea9be5550>
598,Do you know any good online poster stores ?,djsamyak,https://www.reddit.com/r/india/comments/cxx4iy/do_you_know_any_good_online_poster_stores/,3,<praw.models.reddit.submission.SubmissionFlair object at 0x7fcea9be5860>
599,War not an option to deal with Kashmir issue: Pakistan FM Qureshi,wrtjhragsh,https://indianexpress.com/article/india/war-not-an-option-to-deal-with-kashmir-issue-pakistan-foreign-minister-5954163/,4,<praw.models.reddit.submission.SubmissionFlair object at 0x7fcea9be5ac8>
600,I don't know what the fuck is happening with me.,KuShAgRa016,https://www.reddit.com/r/india/comments/cxyw4n/i_dont_know_what_the_fuck_is_happening_with_me/,24,<praw.models.reddit.submission.SubmissionFlair object at 0x7fcea9be5d68>
601,Parables For Your Grandchildren | Parables from religious traditions survive because they give hope. What is happening in India today is not something that can lend itself to any parable,Ajaatshatru34,https://thewire.in/rights/parables-for-your-grandchildren,0,<praw.models.reddit.submission.SubmissionFlair object at 0x7fcea9bee048>
602,"65-year-old shopkeeper killed by terrorists in Parimpora area of Srinagar, search underway",BarLaws,https://zeenews.india.com/jammu-and-kashmir/65-year-old-man-killed-by-terrorists-in-parimpora-area-of-srinagar-search-underway-2230828.html,0,<praw.models.reddit.submission.SubmissionFlair object at 0x7fcea9c57710>
603,NRC List LIVE: Over 19 Lakh Excluded from Final National Register of Citizens in Assam; nrcassam.nic.in Down Amid Rush,indiaisthebestalways,https://www.news18.com/news/india/nrc-list-assam-live-updates-national-register-of-citizens-final-nrc-2019-nrcassam-nic-in-guwahati-news-khabar-2291455.html,25,<praw.models.reddit.submission.SubmissionFlair object at 0x7fcea9b3c198>
604,What happened to 'Make in India' campaign?,buddy_maga,https://www.reddit.com/r/india/comments/cxsvc2/what_happened_to_make_in_india_campaign/,41,<praw.models.reddit.submission.SubmissionFlair object at 0x7fcea9b3c160>
605,"BJP Delhi Chief Manoj Tiwari: National Register of Citizens (NRC) is needed in Delhi as situation is becoming dangerous. Illegal immigrants who have settled here are the most dangerous, we will implement NRC here as well.",silentr3b3I,https://twitter.com/ANI/status/1167670104794062849,11,<praw.models.reddit.submission.SubmissionFlair object at 0x7fcea9d35c50>
606,"Imran Khan cites NRC, says ‘illegal annexation’ of Kashmir part of wider policy to target Muslims",GL4389,https://indianexpress.com/article/india/modi-govts-nrc-drive-a-wider-policy-to-target-muslims-imran-khan-5953831/,0,<praw.models.reddit.submission.SubmissionFlair object at 0x7fcea9ba4f60>
607,Bengaluru Artist Claims Saaho Poster Copied From Her Burning Man Art Installation,HANDSOME_RHYS,https://www.news18.com/news/movies/bengaluru-artist-claims-saaho-poster-copied-from-her-burning-man-art-installation-2290783.html,5,<praw.models.reddit.submission.SubmissionFlair object at 0x7fcea9ba4f28>
608,If this is not brainwashing then tell me what is?,dev_tomato,https://www.reddit.com/r/india/comments/cxv08h/if_this_is_not_brainwashing_then_tell_me_what_is/,11,<praw.models.reddit.submission.SubmissionFlair object at 0x7fcea9ba4ef0>
609,Abduction of Pakistani Sikh Woman: India Calls for 'Immediate Remedial Action',Ajaatshatru34,https://thewire.in/south-asia/abduction-pakistani-sikh-woman-india-immediate-action,3,<praw.models.reddit.submission.SubmissionFlair object at 0x7fcea9ba4eb8>
610,How to be prepared for the upcoming Economic slowdown?,fretboard_squatter,https://www.reddit.com/r/india/comments/cxr1py/how_to_be_prepared_for_the_upcoming_economic/,62,<praw.models.reddit.submission.SubmissionFlair object at 0x7fcea9ba4e80>
611,"Woman Leaves Husband Who Was 'Obsessed' With UPSC Exam, ""Ignored"" Her",Greatfool19000,https://www.ndtv.com/india-news/woman-leaves-husband-who-was-obsessed-with-upsc-exam-ignored-her-2093476?amp=1&akamai-rum=off&__twitter_impression=true,5,<praw.models.reddit.submission.SubmissionFlair object at 0x7fcea9ba4e10>
612,UPI transactions overtake debit card payments in 2018-19: RBI annual report,harddisc,https://www.livemint.com/industry/banking/upi-transactions-overtake-debit-card-payments-in-2018-19-rbi-annual-report-1567247935034.html,1,<praw.models.reddit.submission.SubmissionFlair object at 0x7fcea9ba4dd8>
613,Clicked this yesterday near my house. (Moto G5 and a little editing),brownputin,https://i.redd.it/yz3zyqvhduj31.jpg,0,<praw.models.reddit.submission.SubmissionFlair object at 0x7fcea9ba4da0>
614,Why the government just accepted 5% growth?,Shah_geee,https://www.reddit.com/r/india/comments/cxrvam/why_the_government_just_accepted_5_growth/,34,<praw.models.reddit.submission.SubmissionFlair object at 0x7fcea9ba4d30>
615,"Andhra Pradesh assembly polls: 61 MLAs with criminal cases, 103 garner over 50% votes.",aiyyooooo,https://www.cnbctv18.com/politics/andhra-pradesh-assembly-polls-61-mlas-with-criminal-cases-103-garner-over-50-votes-4248991.htm,2,<praw.models.reddit.submission.SubmissionFlair object at 0x7fcea9ba4cf8>
616,What are the things you wish you did/knew before migrating to another country?,duffer_dev,https://www.reddit.com/r/india/comments/cxv1dz/what_are_the_things_you_wish_you_didknew_before/,2,<praw.models.reddit.submission.SubmissionFlair object at 0x7fcea9ba4cc0>
617,Weird question: Where in Delhi can I get mechanical parts like ' gears / springs / axles / bearings etc ',batbitcoin,https://www.reddit.com/r/india/comments/cxuupb/weird_question_where_in_delhi_can_i_get/,5,<praw.models.reddit.submission.SubmissionFlair object at 0x7fcea9ba4c88>
618,Almost Every World Leader Has Discussed Yoga With Me: PM Modi,hipporama,https://www.ndtv.com/india-news/almost-every-world-leader-has-discussed-yoga-with-me-pm-modi-2093168?amp=1&akamai-rum=off&__twitter_impression=true,33,<praw.models.reddit.submission.SubmissionFlair object at 0x7fcea9ba4be0>
619,Why does ICICI bank want me to a credit card so bad?,unreal_rik,https://www.reddit.com/r/india/comments/cxqx0v/why_does_icici_bank_want_me_to_a_credit_card_so/,100,<praw.models.reddit.submission.SubmissionFlair object at 0x7fcea9ba4ba8>
620,Odisha engineering graduate becomes India’s first-ever gold medallist in World Skill Contest,parshuram__,https://m.hindustantimes.com/education/odisha-engineering-graduate-becomes-india-s-first-ever-gold-medallist-in-world-skill-contest/story-GaxGK3YKeKg51dGnBtyxEL.html,3,<praw.models.reddit.submission.SubmissionFlair object at 0x7fcea9ba4b70>
621,"Mothers of Vemula, Tadvi Move SC for End to Caste Bias on Campuses",vizot,https://www.thequint.com/news/india/mothers-of-rohith-vemula-payal-tadvi-move-sc-for-putting-end-to-caste-based-bias-in-campuses,3,<praw.models.reddit.submission.SubmissionFlair object at 0x7fcea9ba4b38>
622,Propaganda comes of age,Vader44,https://indianexpress.com/article/opinion/columns/propaganda-comes-of-age-films-uri-chalo-jeete-hain-modi-5952337/,5,<praw.models.reddit.submission.SubmissionFlair object at 0x7fcea9ba4a58>
623,Jammu and kashmir: Jammu’s west Pakistan refugees to hold a rally to thank govt,computerbaba7,https://economictimes.indiatimes.com/news/politics-and-nation/jammus-west-pak-refugees-to-hold-a-rally-to-thank-govt/articleshow/70918574.cms,26,<praw.models.reddit.submission.SubmissionFlair object at 0x7fcea9ba4a20>
624,Amid Dwindling Squadrons Strength Indian Air Force Seek 33 New Russian Fighter Jets,nedstark003,https://fighterjetsworld.com/latest-news/amid-dwindling-squadrons-strength-indian-air-force-seek-33-new-russian-fighter-jets/17570/,1,<praw.models.reddit.submission.SubmissionFlair object at 0x7fcea9ba49e8>
625,"What is the best mobile network provider in Dibrugarh, Assam?",Cheeky9,https://www.reddit.com/r/india/comments/cxxxhy/what_is_the_best_mobile_network_provider_in/,0,<praw.models.reddit.submission.SubmissionFlair object at 0x7fcea9ba49b0>
626,UP BJP leader booked for sexually harassing daughter-in-law,shitbjpsays,https://m.hindustantimes.com/india-news/up-bjp-leader-booked-for-sexually-harassing-daughter-in-law/story-ay1aabdOJd8gt8BYDt2QKO_amp.html,0,<praw.models.reddit.submission.SubmissionFlair object at 0x7fcea9bae358>
627,"Bank Mergers: How does 10 banks being merged to create 4 banks, bring down the number of 27 banks to 12? What is the math behind this?",yedeiman,https://www.reddit.com/r/india/comments/cxrio8/bank_mergers_how_does_10_banks_being_merged_to/,33,<praw.models.reddit.submission.SubmissionFlair object at 0x7fcea9bae278>
628,Kargil Set to Protest Against Revocation of Special Status to J&K | NewsClick,Trouble1nParadise,https://www.newsclick.in/kargil-set-protest-against-revocation-special-status-jk,5,<praw.models.reddit.submission.SubmissionFlair object at 0x7fcea9bae1d0>
629,What precautions should i take while booking a traveling package for abroad through travel agent?,Bhenkepakode,https://www.reddit.com/r/india/comments/cxwtlb/what_precautions_should_i_take_while_booking_a/,4,<praw.models.reddit.submission.SubmissionFlair object at 0x7fcea9bae198>
630,Does anyone know any verified organisation that helps people who have survived from Sexual Assault?,XYLOTRON,https://www.reddit.com/r/india/comments/cxu6an/does_anyone_know_any_verified_organisation_that/,2,<praw.models.reddit.submission.SubmissionFlair object at 0x7fcea9bae160>
631,India’s rush for nuclear power may destroy Nallamala forest ecosystem.,KeyPast0,https://www.thenewsminute.com/article/india-s-rush-nuclear-power-may-destroy-nallamala-forest-ecosystem-107155,0,<praw.models.reddit.submission.SubmissionFlair object at 0x7fcea9bae390>
632,Assam NRC Final List: Conspiracy To Keep Hindus Out: Assam BJP Leaders Unhappy With NRC List,SimpleClearCrisp,https://www.ndtv.com/india-news/assam-nrc-final-list-conspiracy-to-keep-hindus-out-assam-bjp-leaders-unhappy-with-nrc-list-2093492,0,<praw.models.reddit.submission.SubmissionFlair object at 0x7fcea9bae630>
633,"Rahul Gandhi Summoned By Mumbai Court For Calling PM ""Commander-In-Thief""",GlobalCitizen12345,https://www.ndtv.com/india-news/rahul-gandhi-summoned-by-mumbai-court-for-calling-pm-commander-in-thief-2093223,14,<praw.models.reddit.submission.SubmissionFlair object at 0x7fcea9bae8d0>
634,NRC list: Over 1.9 million excluded from India citizens list,netizen_green,https://www.aljazeera.com/news/2019/08/nrc-list-19-million-excluded-india-citizens-list-190831044040215.html,6,<praw.models.reddit.submission.SubmissionFlair object at 0x7fcea9baeeb8>
635,BJP Leader Mahesh Chand Sharma Booked for Sexual Harassment of Daughter-in-law,thewebdev,https://www.nationalheraldindia.com/india/bjp-leader-mahesh-chand-sharma-booked-for-sexual-harassment-of-daughter-in-law,3,<praw.models.reddit.submission.SubmissionFlair object at 0x7fcea9bb21d0>
636,Himachal passes Bill against ‘forced conversion’,xyzt1234,https://www.thehindu.com/news/national/other-states/himachal-passes-bill-against-forced-conversion/article29299008.ece/amp/,1,<praw.models.reddit.submission.SubmissionFlair object at 0x7fcea9bb2470>
637,BJP not happy with NRC list as ‘more should have been excluded’: Himanta Biswa Sarma,indiaisthebestalways,https://indianexpress.com/article/india/assam-nrc-final-list-2019-himanta-biswa-sarma-5953329/,1,<praw.models.reddit.submission.SubmissionFlair object at 0x7fcea9bb2780>
638,First Video recording with sound of Mumbai,Repulsive_Anteater,https://www.youtube.com/watch?v=yWP78dkknx8&fbclid=IwAR2jklfNRjW7TqUSWgmUeE77ed1gs5MlbFRODE21MRSvpXILBFQ5M3kY1EU,7,<praw.models.reddit.submission.SubmissionFlair object at 0x7fcea9bb2b00>
639,Bank Mergers,sudden_dust,https://i.redd.it/rjo8v17l0pj31.jpg,6,<praw.models.reddit.submission.SubmissionFlair object at 0x7fcea9bb2e10>
640,8 year girl dies after being denied anti-rabies vaccine for lack of Aadhaar (and more reasons/excuses),firasd,https://timesofindia.indiatimes.com/city/agra/rabies-infected-minor-who-died-waiting-for-treatment-denied-vaccine-15-times-at-chc/articleshow/70832635.cms,55,<praw.models.reddit.submission.SubmissionFlair object at 0x7fcea9bb70f0>
641,Chandrayaan 2 completes fourth lunar orbit manoeuvre: What next?,meekaa_saangoo,https://indianexpress.com/article/india/chandrayaan-2-completes-fourth-lunar-orbit-manoeuvre-what-next-5953421/,0,<praw.models.reddit.submission.SubmissionFlair object at 0x7fcea9bb7400>
642,How are you all not scared shitless?,FlamingNostrils,https://www.reddit.com/r/india/comments/cxlq3x/how_are_you_all_not_scared_shitless/,130,<praw.models.reddit.submission.SubmissionFlair object at 0x7fcea9bb76a0>
643,Honest Question: What is a good and honest Indian bank where I can open a savings account?,abhimanyu_jindal,https://www.reddit.com/r/india/comments/cxvwme/honest_question_what_is_a_good_and_honest_indian/,11,<praw.models.reddit.submission.SubmissionFlair object at 0x7fcea9bb7908>
644,"NIA Summons Cardiologist Dr Upendra Kaul, is Left with Egg on its Face",thewebdev,https://www.nationalheraldindia.com/india/nia-summons-cardiologist-dr-upendra-kaul-is-left-with-egg-on-its-face,18,<praw.models.reddit.submission.SubmissionFlair object at 0x7fcea9bb7ba8>
645,I want to discuss on Indian education system and the mindset of the people.,CallmeRitik,https://www.reddit.com/r/india/comments/cxql7o/i_want_to_discuss_on_indian_education_system_and/,29,<praw.models.reddit.submission.SubmissionFlair object at 0x7fcea9bb7eb8>
646,Vodafone is shutting down their m-pesa wallet business.,ppatra,https://www.reddit.com/r/india/comments/cxs6ru/vodafone_is_shutting_down_their_mpesa_wallet/,5,<praw.models.reddit.submission.SubmissionFlair object at 0x7fcea9bbf198>
647,This Manipur Man Has Single-Handedly Replanted A 300 Acre Forest And Saved Over 250 Species Of Plants,Krenoso,https://www.indiatimes.com/news/india/moirangthem-loiya-has-single-handedly-replanted-a-300-acre-forest-in-manipur-and-saved-over-250-species-of-plants-374674.html,67,<praw.models.reddit.submission.SubmissionFlair object at 0x7fcea9bbf438>
648,Help fellow hungry indian.,Stallrim,https://www.reddit.com/r/india/comments/cy7fx3/help_fellow_hungry_indian/,8,<praw.models.reddit.submission.SubmissionFlair object at 0x7fcea9bbf6d8>
649,"NIA ‘misreads’ blood test as hawala, summons top cardiologist | India News, The Indian Express",beejak,https://www.reddit.com/r/india/comments/cxspps/nia_misreads_blood_test_as_hawala_summons_top/,3,<praw.models.reddit.submission.SubmissionFlair object at 0x7fcea9bbf940>
650,There used to be a Bournvita quiz show hosted by Derek o brien,shivamkimothi,https://www.reddit.com/r/india/comments/cxtafo/there_used_to_be_a_bournvita_quiz_show_hosted_by/,7,<praw.models.reddit.submission.SubmissionFlair object at 0x7fcea9bbfc18>
651,"Assam: Final National Register of Citizens released, 19 lakh people fail the test",Indianopolice,https://economictimes.indiatimes.com/news/politics-and-nation/assam-final-national-register-of-citizens-released/articleshow/70919987.cms,5,<praw.models.reddit.submission.SubmissionFlair object at 0x7fcea9bbff60>
